,categ_product
PINK/WHITE CHRISTMAS TREE 60CM,4
GREEN CHRISTMAS TREE STRING 20LIGHT,3
EUCALYPTUS & PINECONE  WREATH,3
CHRISTMAS PUDDING TRINKET POT ,4
BLACK CHRISTMAS TREE 60CM,0
15CM CHRISTMAS GLASS BALL 20 LIGHTS,1
CARDHOLDER GINGHAM STAR,3
WOODEN STAR CHRISTMAS SCANDINAVIAN,4
FINE WICKER HEART ,0
UNION JACK FLAG PASSPORT COVER ,2
EDWARDIAN PARASOL PINK,1
S/4 CACTI CANDLES,1
PINK MARSHMALLOW SCARF KNITTING KIT,2
6 CHOCOLATE LOVE HEART T-LIGHTS,2
PINK BLUE FELT CRAFT TRINKET BOX,0
TOAST ITS - BEST MUM,0
3 TRADITIONAL COOKIE CUTTERS  SET,2
CHILDRENS SPACEBOY MUG,0
MIRRORED WALL ART SKULLS,0
MIRRORED WALL ART STARS,0
CHARLIE+LOLA PINK HOT WATER BOTTLE,2
CHARLIE+LOLA RED HOT WATER BOTTLE ,3
COWBOYS AND INDIANS BIRTHDAY CARD ,4
RING OF ROSES BIRTHDAY CARD,4
ALARM CLOCK BAKELIKE CHOCOLATE,3
CERAMIC CAKE DESIGN SPOTTED MUG,0
LIPSTICK PEN FUSCHIA,4
BROCADE RING PURSE ,4
GREEN 3 PIECE POLKADOT CUTLERY SET,3
PAINTED METAL PEARS ASSORTED,0
COLOUR GLASS. STAR T-LIGHT HOLDER,3
SWALLOWS GREETING CARD,4
LADLE LOVE HEART PINK,4
"LETTER ""M"" BLING KEY RING",0
"LETTER ""V"" BLING KEY RING",4
"LETTER ""S"" BLING KEY RING",4
"LETTER ""J"" BLING KEY RING",0
WALL TIDY RETROSPOT ,0
BINGO SET,3
KIDS RAIN MAC PINK,4
RED RETROSPOT CUP,4
SQUARE FLOOR CUSHION VINTAGE RED,1
SET/3 VANILLA SCENTED CANDLE IN BOX,3
SET OF 2 TINS VINTAGE BATHROOM ,3
BLUE  DIAMANTE PEN IN GIFT BOX,3
36 PENCILS TUBE SKULLS,0
GREEN FERN JOURNAL ,2
RIBBON REEL FLORA + FAUNA ,0
BLACK EAR MUFF HEADPHONES,1
RED POLKADOT COFFEE  MUG,4
EMPIRE UNION JACK TV DINNER TRAY,3
ASSORTED TUTTI FRUTTI MIRROR,0
SET OF 4 ROSE BOTANICAL CANDLES,0
FELT EGG COSY BLUE RABBIT ,4
LOVE HEART SOCK HANGER,0
SCOTTIES CHILDRENS APRON,0
CHILDS GARDEN BRUSH PINK,2
LADYBIRD + BEE RAFFIA FOOD COVER,3
HOME SWEET HOME MUG,0
CHILDRENS GARDEN GLOVES BLUE,0
CHRYSANTHEMUM SKETCHBOOK ,3
BAG 250g SWIRLY MARBLES,4
BAG 125g SWIRLY MARBLES,4
ROSE 3 WICK MORRIS BOX CANDLE,2
ROSE SCENT CANDLE JEWELLED DRAWER,3
RED RETROSPOT CHILDRENS UMBRELLA,3
WHITE BAMBOO RIBS LAMPSHADE,4
FOLDING UMBRELLA CHOCOLATE POLKADOT,1
CAKE STAND LOVEBIRD 2 TIER WHITE,1
3 GARDENIA MORRIS BOXED CANDLES,2
SET/4 GARDEN ROSE DINNER CANDLE,0
GOLD PRINT PAPER BAG,4
WOODEN HAPPY BIRTHDAY GARLAND,2
SET/4 BADGES CUTE CREATURES,0
BLUE PAISLEY POCKET BOOK,4
PORCELAIN ROSE LARGE ,0
PORCELAIN ROSE SMALL,4
BAKING SET SPACEBOY DESIGN,1
SOAP DISH BROCANTE,2
FLUTED ANTIQUE CANDLE HOLDER,4
PEACE SMALL WOOD LETTERS,1
RED RETROSPOT APRON ,1
TEA TIME KITCHEN APRON,1
FELTCRAFT DOLL MARIA,2
PARTY METAL SIGN ,0
VINTAGE CREAM 3 BASKET CAKE STAND,1
CHRISTMAS RETROSPOT HEART WOOD,4
DOORMAT RESPECTABLE HOUSE,1
MEMO BOARD RETROSPOT  DESIGN,3
PINK/YELLOW FLOWERS HANDBAG,0
CHARLIE+LOLA MY ROOM DOOR SIGN,4
SALLE DE BAIN HOOK,0
CHRISTMAS CARD STACK OF PRESENTS,4
SET 12 KIDS COLOUR  CHALK STICKS,4
SPACEBOY BIRTHDAY CARD,4
ROBOT BIRTHDAY CARD,4
JOY LARGE WOOD LETTERS,1
WORLD WAR 2 GLIDERS ASSTD DESIGNS,4
CHILDRENS APRON APPLES DESIGN,0
ENCHANTED BIRD COATHANGER 5 HOOK,3
TOAST ITS - FAIRY FLOWER,0
CACTI T-LIGHT CANDLES,4
HANGING BAUBLE T-LIGHT HOLDER SMALL,2
12 PENCILS SMALL TUBE RED RETROSPOT,4
BALLOON WATER BOMB PACK OF 35,4
BALLOON PUMP WITH 10 BALLOONS,0
ALPHABET STENCIL CRAFT,0
3 TRADITIONAl BISCUIT CUTTERS  SET,2
IVORY PAPER CUP CAKE CASES ,4
PARTY INVITES WOODLAND,4
PARTY INVITES BALLOON GIRL,4
LOVELY BONBON STICKER SHEET,4
SWEET PUDDING STICKER SHEET,4
ASSTD DESIGN 3D PAPER STICKERS,4
CUTE CATS TAPE,4
TOOTHPASTE TUBE PEN,4
MAGIC DRAWING SLATE PURDEY,4
PACK OF 12 COLOURED PENCILS,4
TOAST ITS - I LOVE YOU ,0
BANK ACCOUNT  GREETING  CARD ,4
EMPIRE BIRTHDAY CARD,4
TEA PARTY BIRTHDAY CARD,4
CARD CAT AND TREE ,4
CARD DOG AND BALL ,4
PENNY FARTHING BIRTHDAY CARD,4
BLUE STRIPE CERAMIC DRAWER KNOB,0
RED SPOT CERAMIC DRAWER KNOB,0
WHITE SPOT BLUE CERAMIC DRAWER KNOB,0
"HOOK, 1 HANGER ,MAGIC GARDEN",4
EMBOSSED GLASS TEALIGHT HOLDER,0
WATERING CAN PINK BUNNY,0
WATERING CAN GREEN DINOSAUR,0
WATERING CAN BLUE ELEPHANT,0
FLYING PIG WATERING CAN,2
VINTAGE BILLBOARD TEA MUG,0
VINTAGE BILLBOARD MUG ,0
LIPSTICK PEN RED,4
FRENCH BLUE METAL DOOR SIGN 1,0
FRENCH BATHROOM SIGN BLUE METAL,0
YELLOW GIANT GARDEN THERMOMETER,1
"CAKESTAND, 3 TIER, LOVEHEART",1
GLASS BELL JAR SMALL,3
GLASS BELL JAR LARGE,1
WATERING CAN GARDEN MARKER,0
KINGS CHOICE MUG,0
FRIDGE MAGNETS LA VIE EN ROSE,4
RED RETROSPOT ROUND CAKE TINS,1
COFFEE MUG CAT + BIRD DESIGN,2
PIN CUSHION BABUSHKA PINK,3
BROCANTE SHELF WITH HOOKS,1
GREEN POLKADOT BOWL,0
RED RETROSPOT BOWL,0
AREA PATROLLED METAL SIGN,2
PICTURE FRAME WOOD TRIPLE PORTRAIT,1
SKULLS  STICKERS,4
SET3 BOOK BOX GREEN GINGHAM FLOWER ,3
POTTING SHED TEA MUG,0
ROUND CAKE TIN VINTAGE RED,1
RETRO PLASTIC ELEPHANT TRAY,4
GOLD MINI TAPE MEASURE ,4
RAINBOW PEGS PHOTO CLIP STRING,4
TEATIME PEN CASE & PENS,4
PHOTO FRAME 3 CLASSIC HANGING,1
3D TRADITIONAL CHRISTMAS STICKERS,0
TRADITIONAL MODELLING CLAY,0
SEASIDE FLYING DISC,0
PEG BAG APPLES DESIGN,2
GREY FLORAL FELTCRAFT SHOULDER BAG,3
CHARLIE LOLA BLUE HOT WATER BOTTLE ,3
SET/3 RED GINGHAM ROSE STORAGE BOX,3
GLASS HEART T-LIGHT HOLDER ,4
TEA TIME PARTY BUNTING,3
WOODEN UNION JACK BUNTING,1
PAPER BUNTING RETROSPOT,2
SMALL WHITE RETROSPOT MUG IN BOX ,3
SMALL RED RETROSPOT MUG IN BOX ,3
"SET 3 RETROSPOT TEA,COFFEE,SUGAR",3
12 PENCILS TALL TUBE RED RETROSPOT,4
RED RETROSPOT PUDDING BOWL,3
RED RETROSPOT TRADITIONAL TEAPOT ,1
DAIRY MAID  PUDDING BOWL,3
ASSORTED CAKES FRIDGE MAGNETS,4
FOOD CONTAINER SET 3 LOVE HEART ,2
DO NOT TOUCH MY STUFF DOOR HANGER ,4
MOODY GIRL DOOR HANGER ,4
KEEP OUT BOYS DOOR HANGER ,0
MOODY BOY  DOOR HANGER ,4
FILIGRIS HEART WITH BUTTERFLY,0
HEART DECORATION PAINTED ZINC ,4
"DECORATION HEN ON NEST, HANGING",0
HEN HOUSE DECORATION,0
PACK OF 12 STICKY BUNNIES,4
MINI WOODEN HAPPY BIRTHDAY GARLAND,0
PINK HAPPY BIRTHDAY BUNTING,1
BLUE HAPPY BIRTHDAY BUNTING,1
WOOD STAMP SET BEST WISHES,4
WOOD STAMP SET HAPPY BIRTHDAY,4
WOOD STAMP SET THANK YOU,4
GLAMOROUS  MUG,0
CREAM WALL PLANTER HEART SHAPED,1
JUMBO BAG SPACEBOY DESIGN,2
RED FLORAL FELTCRAFT SHOULDER BAG,3
PINK FLORAL FELTCRAFT SHOULDER BAG,3
AIRLINE BAG VINTAGE JET SET RED,3
AIRLINE BAG VINTAGE JET SET BROWN,3
COSY SLIPPER SHOES LARGE GREEN,2
WHITE JEWELLED HEART DECORATION,4
IVORY HANGING DECORATION  HEART,4
STRIPEY CHOCOLATE NESTING BOXES,2
CHRISTMAS TREE STAR DECORATION,4
CHRISTMAS TREE DECORATION WITH BELL,4
CHINESE DRAGON PAPER LANTERNS,4
MILK PAN PINK POLKADOT,3
BOOM BOX SPEAKER BOYS,1
PINK FAIRY CAKE CHILDRENS APRON,0
SMALL PINK MAGIC CHRISTMAS TREE,4
SET OF 4 FAIRY CAKE PLACEMATS ,2
RECYCLED PENCIL WITH RABBIT ERASER,4
BLUE CALCULATOR RULER,0
RED FLOCK LOVE HEART PHOTO FRAME,4
SCENTED CANDLE IN DIGITALIS TIN,2
GROW YOUR OWN FLOWERS SET OF 3,1
RED HEART SHAPE LOVE BUCKET ,2
VINTAGE POST OFFICE CABINET,1
SET OF 6 3D KIT CARDS FOR KIDS,4
CLEAR MILKSHAKE GLASS,2
RED BABY BUNTING ,2
BIRDS MOBILE VINTAGE DESIGN,1
WOODLAND  HEIGHT CHART STICKERS ,2
DINOSAUR LUNCH BOX WITH CUTLERY,2
RED SPOTTY BISCUIT TIN,3
CHARLIE + LOLA BISCUITS TINS,2
CHARLIE AND LOLA TABLE TINS,2
CHARLIE AND LOLA FIGURES TINS,2
CAKE STAND WHITE TWO TIER LACE,1
BLUE POLKADOT BOWL,0
PINK  POLKADOT CUP,4
SKULL AND CROSSBONES  GARLAND ,0
PACK OF 6 SKULL PAPER CUPS,4
PACK OF 6 SKULL PAPER PLATES,4
PACK OF 20 SKULL PAPER NAPKINS,4
200 BENDY SKULL STRAWS,0
SKULLS PARTY BAG + STICKER SET,0
SET OF 9 BLACK SKULL BALLOONS,4
STRAWBERRY HONEYCOMB  GARLAND ,0
PINK POLKADOT BOWL,0
SET OF 6 T-LIGHTS WEDDING CAKE ,2
MINI CAKE STAND T-LIGHT HOLDER,4
ROUND CAKE TIN VINTAGE GREEN,1
"BLACK TEA,COFFEE,SUGAR JARS",0
SHOE SHINE BOX ,1
BREAD BIN DINER STYLE MINT,1
VANILLA INCENSE 40 CONES IN TIN,0
LAVENDER INCENSE 40 CONES IN TIN,0
COLUMBIAN CANDLE ROUND ,0
COLUMBIAN CANDLE RECTANGLE,0
ZINC FINISH 15CM PLANTER POTS,0
SMALL SQUARE CUT GLASS CANDLESTICK,3
SILK PURSE BABUSHKA BLUE,3
ARMY CAMO BOOKCOVER TAPE,4
CARROT CHARLIE+LOLA COASTER SET,0
MEMO BOARD COTTAGE DESIGN,3
CHILDS GARDEN SPADE BLUE,2
LOVE HEART NAPKIN BOX ,3
SKULLS GREETING CARD,4
HANGING CHICK  YELLOW DECORATION,0
SET OF 72 SKULL PAPER  DOILIES,0
SET OF 36 PAISLEY FLOWER DOILIES,0
SPACEBOY GIFT WRAP,4
BLUE GLASS CHUNKY CHARM BRACELET,1
BLACK+WHITE NECKLACE W TASSEL,1
AMBER CHUNKY GLASS+BEAD NECKLACE,1
POPPY'S PLAYHOUSE LIVINGROOM ,2
GINGHAM ROSE WRAP,4
12 PENCILS TALL TUBE POSY,4
12 COLOURED PARTY BALLOONS,4
PINK FLOWER CROCHET FOOD COVER,3
FLOWER VINE RAFFIA FOOD COVER,3
FOOD/DRINK SPONGE STICKERS,4
PINK HEART SHAPE PHOTO FRAME,0
LILAC DIAMANTE PEN IN GIFT BOX,1
SILVER DIAMANTE PEN IN GIFT BOX,1
BLUE JUICY FRUIT PHOTO FRAME,2
GREEN JUICY FRUIT PHOTO FRAME,2
GLITTER BUTTERFLY CLIPS,2
ASSORTED CREEPY CRAWLIES,4
VINTAGE UNION JACK MEMOBOARD,1
BASKET OF FLOWERS SEWING KIT,4
ANTIQUE SILVER TEA GLASS ETCHED,0
FAMILY ALBUM WHITE PICTURE FRAME,1
WRAP PINK FAIRY CAKES ,4
BABY BOOM RIBBONS ,0
ENAMEL WASH BOWL CREAM,3
LOCAL CAFE MUG,0
DIAMANTE BOW BROOCH BLACK COLOUR,1
DIAMANTE BOW BROOCH GREEN COLOUR,1
DIAMANTE BOW BROOCH RED COLOUR,1
LILY BROOCH AMETHYST COLOUR,3
PAIR OF ENAMEL BUTTERFLY HAIRCLIP,3
AMETHYST DIAMANTE EXPANDABLE RING,3
PURPLE GEMSTONE BRACELET,1
BLACK GEMSTONE BRACELET,1
PURPLE GEMSTONE NECKLACE 45CM,1
5 STRAND GLASS NECKLACE BLACK,1
DROP DIAMANTE EARRINGS CRYSTAL,2
AMETHYST HOOP EARRING FLORAL LEAF,2
HANGING BAUBLE T-LIGHT HOLDER LARGE,2
CUT GLASS HEXAGON T-LIGHT HOLDER,2
CLAM SHELL SMALL ,0
CLAM SHELL LARGE,3
COCKLE SHELL DISH,0
PARTY PIZZA DISH RED RETROSPOT,4
SPACEBOY TV DINNER TRAY,3
PINK TALL PORCELAIN T-LIGHT HOLDER ,2
WHITE TALL PORCELAIN T-LIGHT HOLDER,2
DOLLY GIRL CHILDRENS EGG CUP,0
"KEY FOB , GARAGE DESIGN",4
GARDEN METAL SIGN ,0
"KEY FOB , FRONT  DOOR ",4
"KEY FOB , BACK DOOR ",4
SET OF 6 CAKE CHOPSTICKS,0
SET OF 6 STRAWBERRY CHOPSTICKS,0
CHRYSANTHEMUM POCKET BOOK ,4
GARDEN PATH POCKET BOOK,4
RED DAISY POCKET BOOK ,4
12 PENCILS TALL TUBE WOODLAND,4
FROG SOCK PUPPET,2
PINK HORSE SOCK PUPPET,2
BLACK WINE GLASS,4
CLASSICAL ROSE CANDLESTAND,4
GAOLERS KEYS DECORATIVE GARDEN ,3
BLACK CHAMPAGNE GLASS,4
RED RETROSPOT PEG BAG,2
FAIRY CAKE DESIGN UMBRELLA,3
BIG DOUGHNUT FRIDGE MAGNETS,4
"WRAP, BILLBOARD FONTS DESIGN",4
GIFT BAG PSYCHEDELIC APPLES,4
BLACK ENCHANTED FOREST PLACEMAT,0
WRAP GREEN PEARS ,4
RED RETROSPOT CHARLOTTE BAG,4
PAPER CHAIN KIT EMPIRE,2
CHARLOTTE BAG PINK POLKADOT,4
TOY TIDY SPACEBOY  ,2
4 ROSE PINK DINNER CANDLES,0
4 SKY BLUE DINNER CANDLES,0
TWO DOOR CURIO CABINET,1
PINK POLKADOT WRAP ,4
ASSORTED COLOURS SILK FAN,4
SPOTTY PINK DUCK DOORSTOP,3
Bank Charges,1
RED RETROSPOT SHOPPER BAG,0
RED RETROSPOT BUTTER DISH,3
LOVE GARLAND PAINTED ZINC ,0
MEASURING TAPE BABUSHKA PINK,2
VINTAGE KID DOLLY CARD ,4
"ELEPHANT, BIRTHDAY CARD, ",4
BLUE POLKADOT WRAP,4
WOODLAND CHARLOTTE BAG,4
VICTORIAN SEWING KIT,0
MIRROR LOVE BIRD T-LIGHT HOLDER,2
BLACK LOVE BIRD T-LIGHT HOLDER,3
HANGING JAM JAR T-LIGHT HOLDER,4
HAND OPEN SHAPE GOLD,3
FELT FARM ANIMAL WHITE BUNNY ,4
RED RETROSPOT PURSE ,2
SNOWSTORM PHOTO FRAME FRIDGE MAGNET,4
RED POLKADOT PUDDING BOWL,0
BLUE POLKADOT PUDDING BOWL,0
VINTAGE BLUE TINSEL REEL,4
JARDIN ETCHED GLASS BUTTER DISH,1
SPACE FROG,0
SPACE CADET BLACK,0
SPACE CADET RED,0
SPACE OWL,0
SPACE CADET WHITE,0
WOODLAND DESIGN  COTTON TOTE BAG,2
ILLUSTRATED CAT BOWL ,2
TOAST ITS - DINOSAUR,0
GARDEN PATH SKETCHBOOK,3
BLUE POLKADOT COFFEE MUG,4
MONSTERS STENCIL CRAFT,0
CITRONELLA CANDLE GARDEN POT,0
MODERN FLORAL STATIONERY SET,0
FUNKY WASHING UP GLOVES ASSORTED,2
FLORAL FOLK STATIONERY SET,0
BLUE POLKADOT WASHING UP GLOVES,2
CHILDS BREAKFAST SET CIRCUS PARADE,1
WOODLAND STORAGE BOX SMALL,2
SKULLS  DESIGN  COTTON TOTE BAG,2
FLOWER BURST SILVER RING CRYSTAL,3
LAUNDRY 15C METAL SIGN,0
FANNY'S REST STOPMETAL SIGN,2
CHOCOLATE THIS WAY METAL SIGN,2
HOT BATHS METAL SIGN,2
POTTERING IN THE SHED METAL SIGN,2
"KEY FOB , SHED",4
LOVE HEART POCKET WARMER,0
BOTANICAL LAVENDER BIRTHDAY CARD,4
GLASS CLOCHE LARGE,1
CORONA MEXICAN TRAY,3
KIDS RAIN MAC BLUE,4
MONEY BOX CONFECTIONERY DESIGN,0
MONEY BOX KINGS CHOICE DESIGN,0
MONEY BOX POCKET MONEY DESIGN,0
ASSORTED COLOUR T-LIGHT HOLDER,4
WEEKEND BAG VINTAGE ROSE PAISLEY,1
CERAMIC CAKE BOWL + HANGING CAKES,2
CHRISTMAS CARD SCREEN PRINT ,4
CHRISTMAS CARD SINGING ANGEL,4
PAPER BUNTING VINTAGE PAISLEY,2
PARTY INVITES DINOSAURS,4
ENAMEL WATERING CAN CREAM,3
ENAMEL COLANDER CREAM,3
BLUE POLKADOT CUP,4
FRYING PAN UNION FLAG,3
BLUE/CREAM STRIPE CUSHION COVER ,0
UNION STRIPE CUSHION COVER ,0
KEY CABINET MA CAMPAGNE,1
CREAM SWEETHEART MINI CHEST,1
DINOSAUR PARTY BAG + STICKER SET,0
IVY HEART WREATH,1
VINTAGE RED KITCHEN CABINET,1
LARGE CAKE STAND HANGING HEARTS,1
LARGE CAKE STAND  HANGING STRAWBERY,1
RED RETROSPOT SUGAR JAM BOWL,2
RED RETROSPOT SHOPPING BAG,2
RED RETROSPOT WASHBAG,2
TEA TIME OVEN GLOVE,0
STRAWBERRY FAIRY CAKE TEAPOT,3
WRAP ENGLISH ROSE ,4
WRAP  PINK FLOCK,4
TUB 24 PINK FLOWER PEGS,0
FENG SHUI PILLAR CANDLE,4
"DECOUPAGE,GREETING CARD,",4
NOVELTY BISCUITS CAKE STAND 3 TIER,1
DAIRY MAID TOASTRACK,0
DAIRY MAID TRADITIONAL TEAPOT ,1
GLITTER HEART GARLAND WITH BELLS ,3
GLITTER STAR GARLAND WITH BELLS ,3
HEART GARLAND RUSTIC PADDED,2
LAVENDER SCENTED FABRIC HEART,0
BLUE POLKADOT PASSPORT COVER,0
SET/6 BEAD COASTERS GAUZE BAG GOLD,4
GROW YOUR OWN HERBS SET OF 3,1
PINK POLKADOT CHILDRENS UMBRELLA,3
WOODEN CROQUET GARDEN SET,1
STAR DECORATION RUSTIC,4
WHITE CHRISTMAS STAR DECORATION,4
HEART DECORATION RUSTIC HANGING ,4
PORCELAIN T-LIGHT HOLDERS ASSORTED,0
CHOC TRUFFLE GOLD TRINKET POT ,0
WASH BAG VINTAGE ROSE PAISLEY,2
CABIN BAG VINTAGE PAISLEY,1
CABIN BAG VINTAGE RETROSPOT,1
POPPY'S PLAYHOUSE BATHROOM,2
TRADITIONAL KNITTING NANCY,0
VINTAGE CREAM CAT FOOD CONTAINER,1
MOROCCAN TEA GLASS,4
FAUX FUR CHOCOLATE THROW,1
RIBBON REEL LACE DESIGN ,2
LUSH GREENS RIBBONS,0
PACK OF 6 SANDCASTLE FLAGS ASSORTED,4
BEADED PEARL HEART WHITE ON STICK,0
3 HEARTS HANGING DECORATION RUSTIC,2
COFFEE MUG DOG + BALL DESIGN,2
HEARTS WRAPPING TAPE ,4
DOGGY RUBBER,4
MAGIC TREE -PAPER FLOWERS,4
BLUE PAISLEY JOURNAL ,2
NECKLACE+BRACELET SET FRUIT SALAD ,2
LARGE PURPLE BABUSHKA NOTEBOOK  ,0
SKULLS TAPE,4
CAKES AND BOWS GIFT  TAPE,4
LARGE YELLOW BABUSHKA NOTEBOOK ,0
LARGE RED BABUSHKA NOTEBOOK ,0
ANGEL DECORATION 3 BUTTONS ,4
75 GREEN PETIT FOUR CASES,4
SET OF 36 TEATIME PAPER DOILIES,0
ROSE DU SUD OVEN GLOVE,2
BROWN CHECK CAT DOORSTOP ,3
BLACK AND WHITE CAT BOWL,0
HOLIDAY FUN LUDO,3
6 RIBBONS EMPIRE  ,0
LA PALMIERA WALL THERMOMETER,2
PACK 20 ENGLISH ROSE PAPER NAPKINS,4
SET/20 STRAWBERRY PAPER NAPKINS ,4
ASSORTED INCENSE PACK,4
VANILLA INCENSE IN TIN,4
YULETIDE IMAGES S/6 PAPER BOXES,2
3D VINTAGE CHRISTMAS STICKERS ,0
SET/3 FLORAL GARDEN TOOLS IN BAG,1
ROBOT MUG IN DISPLAY BOX,0
PACK/12 BLUE FOLKART CARDS,2
"FOLK ART GREETING CARD,pack/12",2
VINTAGE CARAVAN GREETING CARD ,4
SET OF SKULL WALL STICKERS,2
HEARTS  STICKERS,4
ENGLISH ROSE GARDEN SECATEURS,0
"ASSORTED FLOWER COLOUR ""LEIS""",4
EIGHT PIECE SNAKE  SET,0
SMALL CAMPHOR WOOD FIELD  MUSHROOM,0
CAMPHOR WOOD PORTOBELLO MUSHROOM,0
PINK/GREEN FLOWER DESIGN BIG MUG,4
"FLOWER FAIRY,5 SUMMER B'DRAW LINERS",2
RED LOVE HEART SHAPE CUP,4
PINK LOVE HEART SHAPE CUP,4
BLUE/YELLOW FLOWER DESIGN BIG MUG,4
GREEN/BLUE FLOWER DESIGN BIG MUG,4
PINK  HEART SHAPE LOVE BUCKET ,2
SCANDINAVIAN PAISLEY PICNIC BAG,0
PINK VINTAGE PAISLEY PICNIC BAG,0
CHARLIE AND LOLA CHARLOTTE BAG,0
YELLOW/PINK FLOWER DESIGN BIG MUG,4
RED RETROSPOT TEA CUP AND SAUCER ,3
FAIRY CAKE NOTEBOOK A5 SIZE,4
ENGLISH ROSE NOTEBOOK A7 SIZE,4
MORE BUTTER METAL SIGN ,0
HOME SWEET HOME METAL SIGN ,2
PARTY BUNTING,3
STRAWBERRIES  DESIGN FLANNEL ,4
VINTAGE CREAM DOG FOOD CONTAINER,1
DOORMAT NEIGHBOURHOOD WITCH ,1
PHARMACIE FIRST AID TIN,1
NATURAL SLATE CHALKBOARD LARGE ,3
METAL SIGN HIS DINNER IS SERVED,0
BEADED PEARL HEART WHITE LARGE,0
BEADED CRYSTAL HEART BLUE SMALL,0
SET OF SALT AND PEPPER TOADSTOOLS,0
RIBBON REEL POLKADOTS ,0
METAL DECORATION NAUGHTY CHILDREN ,4
CHRISTMAS METAL POSTCARD WITH BELLS,4
"GARLAND, MAGIC GARDEN 1.8M",0
FOLK ART METAL STAR T-LIGHT HOLDER,4
PIG KEYRING WITH LIGHT & SOUND ,0
HELLO SAILOR BLUE SOAP HOLDER,0
COFFEE MUG BLUE PAISLEY DESIGN,2
BEWARE OF THE CAT METAL SIGN ,0
3D SHEET OF DOG STICKERS,4
3D SHEET OF CAT STICKERS,4
BATHROOM SET LOVE HEART DESIGN,2
CINNAMON SCENTED VOTIVE CANDLE,4
JASMINE VOTIVE CANDLE,4
SILVER MUG BONE CHINA TREE OF LIFE,0
WOODLAND PARTY BAG + STICKER SET,0
HOT BATHS SOAP HOLDER,0
12 RED ROSE PEG PLACE SETTINGS,0
BLUE CIRCLES DESIGN MONKEY DOLL,2
VINTAGE PHOTO ALBUM PARIS DAYS,1
MIDNIGHT GLAMOUR SCARF KNITTING KIT,0
FRAPPUCINO SCARF KNITTING KIT,0
SKULL LUNCH BOX WITH CUTLERY ,2
MONEY BOX BISCUITS DESIGN,0
BLUE LEAVES AND BEADS PHONE CHARM,0
BLACK GEMSTONE NECKLACE 45CM,1
VINTAGE ROSE BEAD BRACELET BLACK,3
BLUE/GREEN SHELL NECKLACE W PENDANT,1
SILVER/NATURAL SHELL NECKLACE,1
BLUE POLKADOT PURSE ,3
BLUE POLKADOT LUGGAGE TAG ,0
DAIRY MAID STRIPE MUG,0
MAGNETS PACK OF 4 SWALLOWS,4
BLUE PATCH PURSE PINK HEART,0
BLUE ROUND COMPACT MIRROR,0
TROPICAL LUGGAGE TAG,0
ASSORTED MONKEY SUCTION CUP HOOK,4
ASSORTED TUTTI FRUTTI PEN,4
RED RETROSPOT LUGGAGE TAG,0
MAGNETS PACK OF 4 RETRO PHOTO,4
ASS FLORAL PRINT SPIRIT LEVEL ,0
COLUMBIAN CANDLE ROUND,4
FUSCHIA FLOWER PURSE WITH BEADS,4
ROSE SCENT CANDLE IN JEWELLED BOX,3
DOG TOY WITH PINK CROCHET SKIRT,3
MOUSE TOY WITH PINK T-SHIRT,3
SET/3 OCEAN SCENT CANDLE JEWEL BOX,3
OCEAN SCENT CANDLE IN JEWELLED BOX,3
NURSE'S BAG SOFT TOY,1
BOHEMIAN COLLAGE STATIONERY SET,0
PINK/WHITE RIBBED MELAMINE JUG,1
RED RETROSPOT PICNIC BAG,2
MODERN VINTAGE COTTON SHOPPING BAG,0
STRAWBERRY   PICNIC BAG,2
PINK DOG BOWL,2
GLASS JAR KINGS CHOICE,2
GLASS JAR DAISY FRESH COTTON WOOL,2
GLASS JAR PEACOCK BATH SALTS,3
BATHROOM SCALES FOOTPRINTS IN SAND,3
NEW BAROQUE BLACK PHOTO ALBUM,1
SCENTED VELVET LOUNGE CANDLE ,4
BLUE FLOCK GLASS CANDLEHOLDER,4
SILVER GLITTER FLOWER VOTIVE HOLDER,4
GOLD MUG BONE CHINA TREE OF LIFE,0
SCANDINAVIAN 3 HEARTS NAPKIN RING,4
CHOCOLATE 1 WICK MORRIS BOX CANDLE,2
GARDENIA 3 WICK MORRIS BOXED CANDLE,3
3 ROSE MORRIS BOXED CANDLES,0
PINK BAROQUE FLOCK CANDLE HOLDER,1
SEWING BOX RETROSPOT DESIGN ,1
FELTCRAFT HAIRBAND PINK AND BLUE,4
TEA BAG PLATE RED RETROSPOT,4
GLITTER HANGING BUTTERFLY STRING,2
SET/4 SKULL BADGES,0
CANDY SHOP  STICKER SHEET,4
SET OF 72 PINK HEART PAPER DOILIES,0
SET OF 6 HEART CHOPSTICKS,0
MULTI HEARTS  STICKERS,4
FRYING PAN PINK POLKADOT,3
LITTLE GREEN MONSTER SOFT TOY,2
MOUSEY LONG LEGS SOFT TOY,2
FRENCH LAUNDRY SIGN BLUE METAL,0
RED DRAGONFLY HELICOPTER,1
POTTERING MUG,0
FRENCH ENAMEL POT W LID,2
FRENCH ENAMEL UTENSIL HOLDER,3
WAKE UP COCKEREL CALENDAR SIGN ,3
ENAMEL BLUE RIM COFFEE CONTAINER,0
ENAMEL BLUE RIM BISCUIT BIN,3
"SWISS ROLL TOWEL, PINK  SPOTS",0
FLOWER FAIRY INCENSE BOUQUET,4
GLITTER SNOW PEAR TREE DECORATION,0
CAT BOWL VINTAGE CREAM,3
3 WHITE CHOC MORRIS BOXED CANDLES,2
4 BLUE DINNER CANDLES SILVER FLOCK,2
DANISH ROSE ROUND SEWING BOX,2
CRYSTAL DIAMANTE EXPANDABLE RING,3
WHITE GLASS CHUNKY CHARM BRACELET,1
CAST IRON HOOK GARDEN FORK,2
CAST IRON HOOK GARDEN TROWEL,2
HEART DECORATION WITH PEARLS ,4
RIBBON REEL HEARTS DESIGN ,0
ANT SILVER LIME GREEN BOUDICCA RING,2
ANT SILVER PURPLE BOUDICCA RING,2
VINTAGE UNION JACK PENNANT,0
BEADED LOVE HEART JEWELLERY SET,4
MAGNETS PACK OF 4 VINTAGE LABELS ,4
ASSTD DESIGN RACING CAR PEN,0
HAPPY STENCIL CRAFT,0
ASS DES PHONE SPONGE CRAFT STICKER,4
FORKED CACTUS CANDLE,3
SWEETHEART WIRE FRUIT BOWL,1
COFFEE MUG PINK PAISLEY DESIGN,2
DENIM PATCH PURSE PINK BUTTERFLY,0
YELLOW FLOWERS FELT HANDBAG KIT,2
WHITE TISSUE REAM,1
FELT TOADSTOOL  SMALL,4
FELT FARM ANIMAL CHICKEN,0
12 IVORY ROSE PEG PLACE SETTINGS,0
"SMALL POP BOX,FUNKY MONKEY",0
CHILDRENS GARDEN GLOVES PINK,0
DAISY GARDEN MARKER,0
BIRDHOUSE GARDEN MARKER ,0
STRIPES DESIGN TEDDY,2
RAIN PONCHO RETROSPOT,4
DECORATIVE CATS BATHROOM BOTTLE,0
BASKET OF TOADSTOOLS,0
PINK  HONEYCOMB PAPER BALL ,0
CERAMIC STRAWBERRY TRINKET TRAY,2
CHERRY BLOSSOM  DECORATIVE FLASK,3
DINOSAUR KEYRINGS ASSORTED,4
PAPERWEIGHT CHILDHOOD MEMORIES,2
RED GINGHAM TEDDY BEAR ,2
PINK PAINTED KASHMIRI CHAIR,1
SET/6 PURPLE BUTTERFLY T-LIGHTS,2
75 BLACK PETIT FOUR CASES,4
DOLLY MIXTURE CHILDREN'S UMBRELLA,3
CREAM FELT EASTER EGG BASKET,0
BLUE FELT EASTER EGG BASKET,0
FOLKART HEART NAPKIN RINGS,0
STRAWBERRY DREAM CHILDS UMBRELLA,3
FAIRY CAKES NOTEBOOK A7 SIZE,4
SMALL CHOCOLATES PINK BOWL,4
LARGE CAKE TOWEL PINK SPOTS,1
12 PINK ROSE PEG PLACE SETTINGS,0
UNION FLAG WINDSOCK,0
FLOOR LAMP SHADE WOOD BASE,1
ETCHED GLASS COASTER,4
BUTTERFLY CROCHET FOOD COVER,3
PING MICROWAVE APRON,2
OVEN MITT APPLES DESIGN,0
APRON APPLE DELIGHT,3
GINGHAM OVEN GLOVE RED HEART ,3
CHRISTMAS TREE HEART DECORATION,4
CHRISTMAS MUSICAL ZINC TREE,4
MAGIC DRAWING SLATE LEAP FROG ,4
PERIWINKLE T-LIGHT HOLDER,0
SILICON STAR BULB  BLUE,4
LARGE MEDINA STAMPED METAL BOWL ,1
BLUE NETTING STORAGE HANGER,0
TABLECLOTH RED APPLES DESIGN ,1
"SILICON CUBE 25W, BLUE",4
SET/6 COLLAGE PAPER PLATES,4
MULTICOLOUR HONEYCOMB FAN,4
RETROSPOT PADDED SEAT CUSHION,3
MADRAS NOTEBOOK LARGE ,0
SET OF 3 BIRD LIGHT PINK FEATHER ,4
VINTAGE BEAD NOTEBOOK,2
BEADED CRYSTAL HEART PINK LARGE,0
SANDALWOOD FAN,4
HANGING HEART JAR T-LIGHT HOLDER,0
PACK 6 HEART/ICE-CREAM PATCHES,0
PINK OWL SOFT TOY,2
SET/6 TURQUOISE BUTTERFLY T-LIGHTS,2
CREAM AND PINK FLOWERS PONY ,3
6 ROCKET BALLOONS ,4
BLUE CIRCLES DESIGN TEDDY,2
CRYSTAL FROG PHONE CHARM,0
SOMBRERO ,0
ANIMAL STICKERS,4
GREEN BITTY LIGHT CHAIN,2
RAIN PONCHO ,4
ASSORTED TUTTI FRUTTI BRACELET,4
BLUE TRAVEL FIRST AID KIT,0
FRENCH TOILET SIGN BLUE METAL,0
BLACK GRAND BAROQUE PHOTO FRAME,3
METAL SIGN NEIGHBOURHOOD WITCH ,2
BAG OF SILVER STONES,4
IVORY PILLAR CANDLE SILVER FLOCK,2
IVORY PILLAR CANDLE GOLD FLOCK,2
ABSTRACT CIRCLES SKETCHBOOK ,3
FAIRY CAKES NOTEBOOK A6 SIZE,4
TEA TIME BREAKFAST BASKET,2
ALPHABET HEARTS STICKER SHEET,4
FOLKART STAR CHRISTMAS DECORATIONS,4
ASS COLOUR GLOWING TIARAS,4
WHITE BELL HONEYCOMB PAPER GARLAND ,0
SMALL SILVER TRELLIS CANDLEPOT,2
ROBIN CHRISTMAS CARD,4
36 PENCILS TUBE POSY,0
FOLKART ZINC STAR CHRISTMAS DEC,4
"STRING OF 8 BUTTERFLIES,PINK",0
UTILTY CABINET WITH HOOKS,1
FRENCH BLUE METAL DOOR SIGN 9,0
BATHROOM SCALES RUBBER DUCKS,3
FLOOR CUSHION ELEPHANT CARNIVAL,1
RABBIT  DESIGN  COTTON TOTE BAG,2
JIGSAW TREE WITH BIRDHOUSE,4
EASTER TIN BUNNY BOUQUET,0
EASTER TIN CHICKS PINK DAISY,0
MOTORING TISSUE BOX,4
EMPIRE TISSUE BOX,4
PINK UNION JACK  PASSPORT COVER ,2
KENSINGTON COFFEE SET,1
SET/12 FUNKY FELT FLOWER PEG IN BAG,2
PARTY CONES CANDY TREE DECORATION,4
SET OF 6 T-LIGHTS EASTER CHICKS,2
"LARGE CAKE TOWEL, CHOCOLATE SPOTS",1
PINK PADDED MOBILE,3
S/12 MINI RABBIT EASTER,0
TEA FOR ONE POLKADOT,3
MEDIUM MEDINA STAMPED METAL BOWL ,2
MIRROR CORNICE,1
BLUE & WHITE BREAKFAST TRAY,3
"METAL SIGN,CUPCAKE SINGLE HOOK",0
RETRO PLASTIC 70'S TRAY,4
PAPER POCKET TRAVELING FAN ,4
SCOTTIE DOGS BABY BIB,4
BEADED CRYSTAL HEART PINK SMALL,0
BEADED CRYSTAL HEART GREEN SMALL,0
HANGING FAIRY CAKE DECORATION,2
VINTAGE UNION JACK DOORSTOP,1
BLUE TEATIME PRINT BOWL ,0
MAN FLU METAL SIGN,2
HOUSE WRECKING METAL SIGN ,2
LOVE LARGE WOOD LETTERS ,1
BISCUIT TIN VINTAGE GREEN,1
FRYING PAN RED RETROSPOT,3
SET OF 16 VINTAGE ROSE CUTLERY,1
NEW ENGLAND MUG W GIFT BOX,2
PINK GREEN EMBROIDERY COSMETIC BAG,2
BLUE GREEN EMBROIDERY COSMETIC BAG,3
PAIR PADDED HANGERS PINK CHECK,3
ANGEL DECORATION PAINTED ZINC ,4
SMALL SILVER FLOWER CANDLE POT,2
RED ROSE AND LACE C/COVER,2
GLITTER CHRISTMAS STAR ,4
CARD SUKI BIRTHDAY,4
WRAP SUKI AND FRIENDS,4
BIRDHOUSE DECORATION MAGIC GARDEN,0
BIRDCAGE DECORATION TEALIGHT HOLDER,0
BROWN  PIRATE TREASURE CHEST ,0
BLUE PUDDING SPOON,4
RETRO PINK BALL ASHTRAY ,0
SUMMER FUN DESIGN SHOWER CAP,4
STRIPY DESIGN SHOWER CAP,4
SET/4 DAISY MIRROR MAGNETS,4
SET/4 BIRD MIRROR MAGNETS ,4
SET/4 BUTTERFLY MIRROR MAGNETS,0
FRENCH STYLE EMBOSSED HEART CABINET,1
SKULL DESIGN TV DINNER TRAY,3
GREEN SWEETHEART BRACELET,3
CARNIVAL BRACELET,1
4 PEAR BOTANICAL DINNER CANDLES,0
FUNKY MONKEY MUG,0
QUEEN OF SKIES LUGGAGE TAG,0
ECONOMY LUGGAGE TAG,0
HEART CALCULATOR,0
BISCUITS SMALL BOWL LIGHT BLUE,4
SMALL MARSHMALLOWS PINK BOWL,4
PARTY PIZZA DISH GREEN POLKADOT,4
PARTY PIZZA DISH PINK POLKADOT,4
PARTY PIZZA DISH BLUE POLKADOT,4
ASSORTED CHEESE FRIDGE MAGNETS,4
PEARL CRYSTAL PUMPKIN T-LIGHT HLDR,0
WHITE STITCHED CUSHION COVER,1
PORCELAIN BUTTERFLY OIL BURNER,2
"BREAD BIN, DINER STYLE, MINT",1
"BREAD BIN, DINER STYLE, IVORY",1
SET OF 6 VINTAGE NOTELETS KIT,0
CARD GINGHAM ROSE ,4
SET OF 12  VINTAGE POSTCARD SET,0
LADLE LOVE HEART RED ,4
36 DOILIES DOLLY GIRL,0
ROSE 1 WICK MORRIS BOXED CANDLE,2
SET/6 PINK BIRD T-LIGHT CANDLES,2
ASSORTED TUTTI FRUTTI  FOB NOTEBOOK,4
DOLLY HONEYCOMB GARLAND,0
ROSE FOLKART HEART DECORATIONS,0
GLITTER CHRISTMAS TREE WITH BELLS,0
PINK KNITTED EGG COSY,4
BLUE KNITTED EGG COSY,4
WAY OUT METAL SIGN ,0
SAVOY ART DECO CLOCK,1
HALL CABINET WITH 3 DRAWERS,1
DOORMAT HOME SWEET HOME BLUE ,1
BLUE WIRE SPIRAL CANDLE HOLDER,1
S/12 VANILLA  BOTANICAL T-LIGHTS,2
SMALL HAMMERED SILVER CANDLEPOT ,2
WHITE CHRYSANTHEMUMS ART FLOWER,2
RETRO PLASTIC DAISY TRAY,4
ANGEL DECORATION WITH LACE PADDED,4
SUNSET CHECK HAMMOCK,1
RETRO PLASTIC POLKA TRAY,4
WHITE BROCANTE SOAP DISH,2
ABSTRACT CIRCLE JOURNAL ,2
CHRYSANTHEMUM  JOURNAL,2
ASSTD MULTICOLOUR CIRCLES MUG,4
6 EGG HOUSE PAINTED WOOD,1
FRENCH CHATEAU LARGE PLATTER ,2
ENVELOPE 50 CURIOUS IMAGES,4
FOLDING CAMPING SCISSOR W/KNIF & S,4
HAND OPEN SHAPE DECO.WHITE,3
PINK JEWELLED MIRROR TRINKET TRAY,1
WHITE SAGE INCENSE,4
AFGHAN SLIPPER SOCK PAIR,3
SET OF 6 T-LIGHTS CACTI ,3
CITRONELLA CANDLE FLOWERPOT,2
SMALL GLASS SUNDAE DISH CLEAR,0
VINTAGE CARAVAN GIFT WRAP,4
GOLD EAR MUFF HEADPHONES,1
PAPERWEIGHT SAVE THE PLANET,0
SET/3 ROSE CANDLE IN JEWELLED BOX,3
RED RETROSPOT STORAGE JAR,3
POCKET BAG BLUE PAISLEY RED SPOT,0
POCKET BAG PINK PAISELY BROWN SPOT,0
ESSENTIAL BALM 3.5g TIN IN ENVELOPE,4
BUTTERFLIES STICKERS,4
CAKE SHOP  STICKER SHEET,4
72 CAKE CASES VINTAGE CHRISTMAS,4
SET OF 16 VINTAGE SKY BLUE CUTLERY,1
"TUMBLER, BAROQUE",0
SMALL POLKADOT CHOCOLATE GIFT BAG ,4
LARGE STRIPES CHOCOLATE GIFT BAG,0
WOODEN SKITTLES GARDEN SET,1
CUBIC MUG FLOCK BLUE ON BROWN,4
CUBIC MUG PINK POLKADOT,4
VINTAGE KEEPSAKE BOX TRAVELOGUE,1
VINTAGE NOTEBOOK PARIS DAYS,2
"PINK/WHITE ""KEEP CLEAN"" BULLET BIN",2
FRENCH BLUE METAL DOOR SIGN 8,0
FRENCH BLUE METAL DOOR SIGN 0,0
SET OF 36 MUSHROOM PAPER DOILIES,0
DOORMAT WELCOME PUPPIES,1
