,categ_product
WHITE HANGING HEART T-LIGHT HOLDER,2
WHITE METAL LANTERN,3
CREAM CUPID HEARTS COAT HANGER,3
KNITTED UNION FLAG HOT WATER BOTTLE,3
RED WOOLLY HOTTIE WHITE HEART.,3
SET 7 BABUSHKA NESTING BOXES,1
GLASS STAR FROSTED T-LIGHT HOLDER,3
HAND WARMER UNION JACK,2
HAND WARMER RED POLKA DOT,0
ASSORTED COLOUR BIRD ORNAMENT,0
POPPY'S PLAYHOUSE BEDROOM ,2
POPPY'S PLAYHOUSE KITCHEN,2
FELTCRAFT PRINCESS CHARLOTTE DOLL,3
IVORY KNITTED MUG COSY ,0
BOX OF 6 ASSORTED COLOUR TEASPOONS,3
BOX OF VINTAGE JIGSAW BLOCKS ,1
BOX OF VINTAGE ALPHABET BLOCKS,1
HOME BUILDING BLOCK WORD,1
LOVE BUILDING BLOCK WORD,1
RECIPE BOX WITH METAL HEART,1
DOORMAT NEW ENGLAND,1
JAM MAKING SET WITH JARS,3
RED COAT RACK PARIS FASHION,3
YELLOW COAT RACK PARIS FASHION,3
BLUE COAT RACK PARIS FASHION,3
BATH BUILDING BLOCK WORD,1
ALARM CLOCK BAKELIKE PINK,3
ALARM CLOCK BAKELIKE RED ,3
ALARM CLOCK BAKELIKE GREEN,3
PANDA AND BUNNIES STICKER SHEET,4
STARS GIFT TAPE ,4
INFLATABLE POLITICAL GLOBE ,4
VINTAGE HEADS AND TAILS CARD GAME ,0
SET/2 RED RETROSPOT TEA TOWELS ,3
ROUND SNACK BOXES SET OF4 WOODLAND ,2
SPACEBOY LUNCH BOX ,0
LUNCH BOX I LOVE LONDON,0
CIRCUS PARADE LUNCH BOX ,0
CHARLOTTE BAG DOLLY GIRL DESIGN,4
RED TOADSTOOL LED NIGHT LIGHT,0
 SET 2 TEA TOWELS I LOVE LONDON ,3
VINTAGE SEASIDE JIGSAW PUZZLES,3
MINI JIGSAW CIRCUS PARADE ,4
MINI JIGSAW SPACEBOY,4
MINI PAINT SET VINTAGE ,4
POSTAGE,1
PAPER CHAIN KIT 50'S CHRISTMAS ,2
EDWARDIAN PARASOL RED,1
RETRO COFFEE MUGS ASSORTED,0
SAVE THE PLANET MUG,0
VINTAGE BILLBOARD DRINK ME MUG,0
VINTAGE BILLBOARD LOVE/HATE MUG,0
WOOD 2 DRAWER CABINET WHITE FINISH,1
WOOD S/3 CABINET ANT WHITE FINISH,1
WOODEN PICTURE FRAME WHITE FINISH,2
WOODEN FRAME ANTIQUE WHITE ,2
VICTORIAN SEWING BOX LARGE,1
HOT WATER BOTTLE TEA AND SYMPATHY,3
RED HANGING HEART T-LIGHT HOLDER,2
JUMBO BAG PINK POLKADOT,2
JUMBO  BAG BAROQUE BLACK WHITE,2
JUMBO BAG CHARLIE AND LOLA TOYS,2
STRAWBERRY CHARLOTTE BAG,4
RED 3 PIECE RETROSPOT CUTLERY SET,3
BLUE 3 PIECE POLKADOT CUTLERY SET,3
SET/6 RED SPOTTY PAPER PLATES,4
LUNCH BAG RED RETROSPOT,0
STRAWBERRY LUNCH BOX WITH CUTLERY,2
LUNCH BOX WITH CUTLERY RETROSPOT ,2
PACK OF 72 RETROSPOT CAKE CASES,4
PACK OF 60 DINOSAUR CAKE CASES,4
PACK OF 60 PINK PAISLEY CAKE CASES,4
60 TEATIME FAIRY CAKE CASES,4
TOMATO CHARLIE+LOLA COASTER SET,0
CHARLIE & LOLA WASTEPAPER BIN FLORA,0
RED CHARLIE+LOLA PERSONAL DOORSIGN,4
JUMBO STORAGE BAG SUKI,2
JUMBO BAG PINK VINTAGE PAISLEY,2
JAM MAKING SET PRINTED,0
RETROSPOT TEA SET CERAMIC 11 PC ,3
GIRLY PINK TOOL SET,3
JUMBO SHOPPER VINTAGE RED PAISLEY,2
"AIRLINE LOUNGE,METAL SIGN",2
WHITE SPOT RED CERAMIC DRAWER KNOB,0
RED DRAWER KNOB ACRYLIC EDWARDIAN,0
CLEAR DRAWER KNOB ACRYLIC EDWARDIAN,0
PHOTO CLIP LINE,0
FELT EGG COSY CHICKEN,4
PIGGY BANK RETROSPOT ,2
SKULL SHOULDER BAG,0
YOU'RE CONFUSING ME METAL SIGN ,0
COOK WITH WINE METAL SIGN ,2
GIN + TONIC DIET METAL SIGN,2
YELLOW BREAKFAST CUP AND SAUCER,4
PINK BREAKFAST CUP AND SAUCER ,0
PAPER CHAIN KIT RETROSPOT,2
SMALL HEART FLOWERS HOOK ,4
TEA TIME DES TEA COSY,2
FELT EGG COSY WHITE RABBIT ,4
ZINC WILLIE WINKIE  CANDLE STICK,4
CERAMIC CHERRY CAKE MONEY BANK,0
RETROSPOT LARGE MILK JUG,3
SET OF 6 FUNKY BEAKERS,3
EDWARDIAN PARASOL BLACK,1
EDWARDIAN PARASOL NATURAL,1
CERAMIC STRAWBERRY CAKE MONEY BANK,0
BLUE OWL SOFT TOY,2
BALLOON ART MAKE YOUR OWN FLOWERS,0
GLASS CLOCHE SMALL,3
GUMBALL MONOCHROME COAT RACK,0
DOORMAT FANCY FONT HOME SWEET HOME,1
Discount,1
VINTAGE SNAKES & LADDERS,3
CHOCOLATE CALCULATOR,0
RECYCLING BAG RETROSPOT ,2
TOY TIDY PINK POLKADOT,2
ANTIQUE GLASS DRESSING TABLE POT,2
IVORY GIANT GARDEN THERMOMETER,1
3 TIER CAKE TIN GREEN AND CREAM,1
3 TIER CAKE TIN RED AND CREAM,1
SET 3 WICKER OVAL BASKETS W LIDS,1
WOOD BLACK BOARD ANT WHITE FINISH,1
COLOUR GLASS T-LIGHT HOLDER HANGING,4
HANGING METAL HEART LANTERN,0
HANGING MEDINA LANTERN SMALL,2
NATURAL SLATE HEART CHALKBOARD ,2
HEART OF WICKER SMALL,0
HEART OF WICKER LARGE,2
WHITE LOVEBIRD LANTERN,2
CLASSIC METAL BIRDCAGE PLANT HOLDER,1
CREAM HEART CARD HOLDER,3
ENAMEL FLOWER JUG CREAM,1
ENAMEL FIRE BUCKET CREAM,1
ENAMEL BREAD BIN CREAM,1
JUMBO BAG DOLLY GIRL DESIGN,2
TRADITIONAL CHRISTMAS RIBBONS,0
ORGANISER WOOD ANTIQUE WHITE ,1
LUNCH BAG DOLLY GIRL DESIGN,0
WHITE WIRE EGG HOLDER,1
JUMBO BAG RED RETROSPOT,2
CHILLI LIGHTS,1
LIGHT GARLAND BUTTERFILES PINK,3
WOODEN OWLS LIGHT GARLAND ,3
FAIRY TALE COTTAGE NIGHTLIGHT,0
HOME SMALL WOOD LETTERS,3
GINGHAM HEART  DOORSTOP RED,3
FIVE HEART HANGING DECORATION,2
ASSORTED BOTTLE TOP  MAGNETS ,4
FRIDGE MAGNETS US DINER ASSORTED,4
HOMEMADE JAM SCENTED CANDLES,0
FRIDGE MAGNETS LES ENFANTS ASSORTED,4
ROSE CARAVAN DOORSTOP,1
5 HOOK HANGER MAGIC TOADSTOOL,0
CHRISTMAS LIGHTS 10 REINDEER,1
VINTAGE UNION JACK CUSHION COVER,3
SET OF 3 COLOURED  FLYING DUCKS,1
SET OF 3 GOLD FLYING DUCKS,1
RED RETROSPOT UMBRELLA,1
BLACK/BLUE POLKADOT UMBRELLA,1
RED DINER WALL CLOCK,1
BLUE DINER WALL CLOCK,1
IVORY DINER WALL CLOCK,1
LARGE HEART MEASURING SPOONS,0
SMALL HEART MEASURING SPOONS,4
JAM JAR WITH PINK LID,4
JAM JAR WITH GREEN LID,4
ROSE COTTAGE KEEPSAKE BOX ,1
HANGING HEART ZINC T-LIGHT HOLDER,4
PAPER CHAIN KIT VINTAGE CHRISTMAS,2
DISCO BALL CHRISTMAS DECORATION,4
SMALL POPCORN HOLDER,4
LARGE POPCORN HOLDER ,0
SET/20 RED RETROSPOT PAPER NAPKINS ,4
SET/6 RED SPOTTY PAPER CUPS,4
POLKADOT RAIN HAT ,4
DELUXE SEWING KIT ,1
RETROSPOT HEART HOT WATER BOTTLE,3
ENGLISH ROSE HOT WATER BOTTLE,3
PHOTO CUBE,0
3 STRIPEY MICE FELTCRAFT,0
SET OF 6 SOLDIER SKITTLES,3
TRADITIONAL WOODEN SKIPPING ROPE,0
WOODEN BOX OF DOMINOES,0
RUSTIC  SEVENTEEN DRAWER SIDEBOARD,1
PARTY CONES CARNIVAL ASSORTED,0
PARTY CONES CANDY ASSORTED,0
PICNIC BASKET WICKER SMALL,1
STAR DECORATION PAINTED ZINC ,4
RETROSPOT LAMP,1
"FANCY FONT BIRTHDAY CARD, ",4
HAND WARMER SCOTTY DOG DESIGN,2
HAND WARMER OWL DESIGN,2
HAND WARMER RED RETROSPOT,2
DOG BOWL CHASING BALL DESIGN,3
CLOTHES PEGS RETROSPOT PACK 24 ,0
HAND OVER THE CHOCOLATE   SIGN ,2
TRAVEL SEWING KIT,0
BLACK HEART CARD HOLDER,3
CHICK GREY HOT WATER BOTTLE,3
SMALL GLASS HEART TRINKET POT,2
ALARM CLOCK BAKELIKE IVORY,3
ALARM CLOCK BAKELIKE ORANGE,3
HAND WARMER BIRD DESIGN,2
IVORY EMBROIDERED QUILT ,1
SET OF 3 BLACK FLYING DUCKS,1
PACK OF 12 RED RETROSPOT TISSUES ,4
RED RETROSPOT MUG,2
BABUSHKA LIGHTS STRING OF 10,1
DOORMAT FAIRY CAKE,1
STRAWBERRY CERAMIC TRINKET BOX,0
PINK DOUGHNUT TRINKET POT ,0
SILK PURSE BABUSHKA PINK,3
HOT WATER BOTTLE I AM SO POORLY,3
CHOCOLATE HOT WATER BOTTLE,3
WHITE SKULL HOT WATER BOTTLE ,3
SCOTTIE DOG HOT WATER BOTTLE,3
BIRD HOUSE HOT WATER BOTTLE,2
BOUDOIR SQUARE TISSUE BOX,4
SKULLS SQUARE TISSUE BOX,4
PHOTO FRAME CORNICE,2
SILK PURSE BABUSHKA RED,3
PICTURE DOMINOES,0
S/6 SEW ON CROCHET FLOWERS,0
SCANDINAVIAN REDS RIBBONS,0
BALLOONS  WRITING SET ,0
LAVENDER INCENSE IN TIN,4
TV DINNER TRAY VINTAGE PAISLEY,3
SET OF 4 ENGLISH ROSE PLACEMATS,3
SET OF 4 ENGLISH ROSE COASTERS,0
TRIPLE PHOTO FRAME CORNICE ,1
FAMILY PHOTO FRAME CORNICE,1
MIRRORED DISCO BALL ,1
DISCO BALL ROTATOR BATTERY OPERATED,3
SILVER LOOKING MIRROR,3
LADIES & GENTLEMEN METAL SIGN,2
METAL SIGN HER DINNER IS SERVED ,2
DOORMAT TOPIARY,1
BATHROOM METAL SIGN,4
KITCHEN METAL SIGN,4
TOILET METAL SIGN,4
METAL SIGN TAKE IT OR LEAVE IT ,2
I'M ON HOLIDAY METAL SIGN,2
GROW YOUR OWN BASIL IN ENAMEL MUG,2
SET/10 PINK POLKADOT PARTY CANDLES,0
SET 20 NAPKINS FAIRY CAKES DESIGN ,4
SET OF 6 T-LIGHTS SNOWMEN,3
SET OF 6 T-LIGHTS SANTA,3
SET OF 9 HEART SHAPED BALLOONS,0
SANDWICH BATH SPONGE,0
APPLE BATH SPONGE,0
STRAWBERRY BATH SPONGE ,0
BLACK PIRATE TREASURE CHEST,0
STAR PORTABLE TABLE LIGHT ,2
SNOWFLAKE PORTABLE TABLE LIGHT ,3
PINK OVAL JEWELLED MIRROR,1
RETROSPOT CIGAR BOX MATCHES ,0
COSY HOUR GIANT TUBE MATCHES,2
JAZZ HEARTS PURSE NOTEBOOK,4
CANDLEHOLDER PINK HANGING HEART,2
ASSORTED COLOUR MINI CASES,1
LUNCH BAG SPACEBOY DESIGN ,0
LUNCH BAG WOODLAND,0
LUNCH BAG PINK POLKADOT,0
GUMBALL COAT RACK,2
BLUE NEW BAROQUE CANDLESTICK CANDLE,0
PINK NEW BAROQUECANDLESTICK CANDLE,0
FAIRY CAKE FLANNEL ASSORTED COLOUR,0
BREAD BIN DINER STYLE PINK,1
TEA TIME TABLE CLOTH,1
HOT WATER BOTTLE BABUSHKA ,3
HEART IVORY TRELLIS SMALL,0
PINK DRAWER KNOB ACRYLIC EDWARDIAN,0
GREEN DRAWER KNOB ACRYLIC EDWARDIAN,0
BLUE DRAWER KNOB ACRYLIC EDWARDIAN,0
SET 6 FOOTBALL CELEBRATION CANDLES,0
SET OF 6 GIRLS CELEBRATION CANDLES,0
ROMANTIC PINKS RIBBONS ,0
BRIGHT BLUES RIBBONS ,0
CHOCOLATE BOX RIBBONS ,0
PARTY INVITES FOOTBALL,4
PARTY INVITES JAZZ HEARTS,4
PARTY INVITES SPACEMAN,4
SET OF 3 BUTTERFLY COOKIE CUTTERS,0
SET OF 3 HEART COOKIE CUTTERS,0
3 PIECE SPACEBOY COOKIE CUTTER SET,2
PACK OF 72 SKULL CAKE CASES,4
PACK OF 60 SPACEBOY CAKE CASES,4
72 SWEETHEART FAIRY CAKE CASES,4
LUNCH BAG SUKI  DESIGN ,0
LUNCH BAG CARS BLUE,0
LUNCH BAG  BLACK SKULL.,0
HEART IVORY TRELLIS LARGE,0
SET/5 RED RETROSPOT LID GLASS BOWLS,2
MAGIC DRAWING SLATE DINOSAUR,4
MAGIC DRAWING SLATE BAKE A CAKE ,4
12 PENCILS TALL TUBE SKULLS,4
RED  HARMONICA IN BOX ,0
BLUE HARMONICA IN BOX ,0
SKULLS  WATER TRANSFER TATTOOS ,4
PACK 3 BOXES BIRD PANNETONE ,2
SET OF 20 KIDS COOKIE CUTTERS,2
10 COLOUR SPACEBOY PEN,4
VICTORIAN GLASS HANGING T-LIGHT,0
SINGLE HEART ZINC T-LIGHT HOLDER,0
HANGING METAL STAR LANTERN,0
SILVER HANGING T-LIGHT HOLDER,0
DOORMAT RED RETROSPOT,1
DOORMAT HEARTS,1
NATURAL SLATE RECTANGLE CHALKBOARD,0
LOVEBIRD HANGING DECORATION WHITE ,4
PENS ASSORTED FUNNY FACE,4
CARD CIRCUS PARADE,4
WRAP COWBOYS  ,4
AIRLINE BAG VINTAGE TOKYO 78,3
SET OF 72 RETROSPOT PAPER  DOILIES,0
PLASTERS IN TIN SKULLS,0
SLEEPING CAT ERASERS,4
CARD BIRTHDAY COWBOY,4
PACK 3 BOXES CHRISTMAS PANNETONE,2
ROTATING SILVER ANGELS T-LIGHT HLDR,2
RIBBON REEL MAKING SNOWMEN ,0
4 TRADITIONAL SPINNING TOPS,0
BAG 500g SWIRLY MARBLES,0
5 STRAND GLASS NECKLACE CRYSTAL,1
SQUARECUSHION COVER PINK UNION FLAG,1
SPACEBOY CHILDRENS EGG CUP,0
CHILDREN'S SPACEBOY MUG,0
FELTCRAFT CUSHION OWL,3
BLACK CANDELABRA T-LIGHT HOLDER,0
TOY TIDY DOLLY GIRL DESIGN,2
SET 12 LAVENDER  BOTANICAL T-LIGHTS,2
UNION JACK FLAG LUGGAGE TAG,0
RED HEART LUGGAGE TAG,0
RED GLASS TASSLE BAG CHARM,2
CLEAR ACRYLIC FACETED BANGLE,2
DOORMAT UNION JACK GUNS AND ROSES,1
VANILLA SCENT CANDLE JEWELLED BOX,3
FULL ENGLISH BREAKFAST PLATE,3
MAGIC DRAWING SLATE CIRCUS PARADE  ,4
CHRISTMAS HANGING HEART WITH BELL,0
CAKE STAND VICTORIAN FILIGREE MED,1
PAISLEY PATTERN  STICKERS,4
FLOWERS  STICKERS,0
BLACK LOVE BIRD CANDLE,0
PARTY TIME PENCIL ERASERS,4
PINK B'FLY C/COVER W BOBBLES,1
PINK UNION JACK  LUGGAGE TAG,0
6 RIBBONS ELEGANT CHRISTMAS ,0
AGED GLASS SILVER T-LIGHT HOLDER,4
BOOM BOX SPEAKER GIRLS,3
6 RIBBONS SHIMMERING PINKS ,0
JUMBO BAG OWLS,2
OWL DOORSTOP,3
PAINTED METAL STAR WITH HOLLY BELLS,4
PAINTED METAL HEART WITH HOLLY BELL,4
ANGEL DECORATION STARS ON DRESS,4
JUMBO BAG STRAWBERRY,2
STRAWBERRY SHOPPER BAG,0
ROUND SNACK BOXES SET OF 4 FRUITS ,2
ROUND SNACK BOXES SET OF 4 SKULLS,2
DOLLY GIRL LUNCH BOX,0
GREEN POLKADOT PLATE ,0
BLUE POLKADOT PLATE ,0
RED RETROSPOT PLATE ,0
PINK  POLKADOT PLATE ,0
FELTCRAFT DOLL MOLLY,2
FELTCRAFT CHRISTMAS FAIRY,3
SET OF 3 NOTEBOOKS IN PARCEL,0
RED RETROSPOT TAPE,4
COSY SLIPPER SHOES SMALL  RED ,2
6 RIBBONS RUSTIC CHARM,0
12 DAISY PEGS IN WOOD BOX,0
5 HOOK HANGER RED MAGIC TOADSTOOL,0
CHRISTMAS CRAFT TREE TOP ANGEL,2
CHRISTMAS CRAFT LITTLE FRIENDS,2
COSY SLIPPER SHOES SMALL GREEN,2
FELTCRAFT DOLL ROSIE,2
FELTCRAFT DOLL EMILY,2
FELTCRAFT PRINCESS OLIVIA DOLL,3
REX CASH+CARRY JUMBO SHOPPER,4
FELTCRAFT CUSHION RABBIT,3
FELTCRAFT CUSHION BUTTERFLY,3
TOTE BAG I LOVE LONDON,2
FOLDING UMBRELLA PINKWHITE POLKADOT,1
FOLDING UMBRELLA CREAM POLKADOT,3
FOLDING UMBRELLA WHITE/RED POLKADOT,3
SET 10 LIGHTS NIGHT OWL,1
FOLDING UMBRELLA RED/WHITE POLKADOT,1
S/4 VALENTINE DECOUPAGE HEART BOX,2
SOLDIERS EGG CUP ,0
RED RETROSPOT MINI CASES,1
60 CAKE CASES VINTAGE CHRISTMAS,4
RIBBON REEL CHRISTMAS SOCK BAUBLE,0
RIBBON REEL SNOWY VILLAGE,0
SET OF 20 VINTAGE CHRISTMAS NAPKINS,4
TURQUOISE CHRISTMAS TREE ,0
RED STAR CARD HOLDER,2
WICKER WREATH SMALL,0
ADVENT CALENDAR GINGHAM SACK,1
FELTCRAFT BUTTERFLY HEARTS,0
PARTY CONE CHRISTMAS DECORATION ,4
WICKER STAR ,2
VINTAGE SNAP CARDS,4
FELTCRAFT 6 FLOWER FRIENDS,2
BIRD DECORATION RED RETROSPOT,4
CHRISTMAS GINGHAM TREE,4
CHRISTMAS GINGHAM STAR,4
CHRISTMAS GINGHAM HEART,4
PACK OF 12 PINK POLKADOT TISSUES,4
FELTCRAFT PRINCESS LOLA DOLL,3
PACK OF 12 LONDON TISSUES ,4
PURPLE DRAWERKNOB ACRYLIC EDWARDIAN,0
CHILDREN'S APRON DOLLY GIRL ,2
CHILDRENS APRON SPACEBOY DESIGN,0
CHRISTMAS LIGHTS 10 SANTAS ,1
PACK OF 60 MUSHROOM CAKE CASES,4
60 CAKE CASES DOLLY GIRL DESIGN,4
HAND WARMER BABUSHKA DESIGN,0
SET 12 RETRO WHITE CHALK STICKS,4
FELTCRAFT HAIRBAND RED AND BLUE,4
FELTCRAFT HAIRBAND PINK AND PURPLE,4
FELTCRAFT HAIRBANDS PINK AND WHITE ,4
TV DINNER TRAY DOLLY GIRL,3
PLASTERS IN TIN VINTAGE PAISLEY ,0
PLASTERS IN TIN SPACEBOY,0
PLASTERS IN TIN WOODLAND ANIMALS,0
MAGIC DRAWING SLATE SPACEBOY ,4
MAGIC DRAWING SLATE GO TO THE FAIR ,4
MAGIC DRAWING SLATE DOLLY GIRL ,4
CHARLIE + LOLA RED HOT WATER BOTTLE,2
URBAN BLACK RIBBONS ,0
SET OF 6 T-LIGHTS TOADSTOOLS,2
ROTATING LEAVES T-LIGHT HOLDER,0
CUPCAKE LACE PAPER SET 6,0
TRADITIONAL WOODEN CATCH CUP GAME ,0
S/6 WOODEN SKITTLES IN COTTON BAG,3
RED METAL BEACH SPADE ,0
BOYS VINTAGE TIN SEASIDE BUCKET,2
GIRLS VINTAGE TIN SEASIDE BUCKET,2
GREY HEART HOT WATER BOTTLE,3
KINGS CHOICE TEA CADDY ,2
KINGS CHOICE BISCUIT TIN,3
METAL SIGN EMPIRE TEA,0
FAWN BLUE HOT WATER BOTTLE,3
PACK OF 6 BIRDY GIFT TAGS,0
CERAMIC STRAWBERRY MONEY BOX,2
CERAMIC HEART FAIRY CAKE MONEY BANK,0
CERAMIC PIRATE CHEST MONEY BANK,0
DOORSTOP RETROSPOT HEART,3
RETROSPOT BABUSHKA DOORSTOP,2
SWEETHEART WIRE WALL TIDY,1
RED RETROSPOT OVEN GLOVE ,0
NAMASTE SWAGAT INCENSE,4
CERAMIC STRAWBERRY DESIGN MUG,0
CLASSICAL ROSE SMALL VASE,2
HYACINTH BULB T-LIGHT CANDLES,4
CHRISTMAS CRAFT WHITE FAIRY ,0
COSY HOUR CIGAR BOX MATCHES ,0
RED TEA TOWEL CLASSIC DESIGN,0
HEART FILIGREE DOVE  SMALL,0
RETROSPOT CHILDRENS APRON,2
COLOURING PENCILS BROWN TUBE,4
4 IVORY DINNER CANDLES SILVER FLOCK,2
ZINC METAL HEART DECORATION,0
GREEN FERN NOTEBOOK,0
BLUE PAISLEY NOTEBOOK,0
CHRYSANTHEMUM NOTEBOOK,0
LARGE CHINESE STYLE SCISSOR,4
SMALL CHINESE STYLE SCISSOR,4
HANGING GLASS ETCHED TEALIGHT,0
COOKING SET RETROSPOT,1
KINGS CHOICE GIANT TUBE MATCHES,2
PLACE SETTING WHITE STAR,4
S/15 SILVER GLASS BAUBLES IN BAG,0
FRENCH WC SIGN BLUE METAL,0
FAIRY SOAP SOAP HOLDER,0
GREEN GIANT GARDEN THERMOMETER,1
BLUE GIANT GARDEN THERMOMETER,1
VICTORIAN SEWING BOX SMALL ,1
VICTORIAN SEWING BOX MEDIUM,1
SET/10 RED POLKADOT PARTY CANDLES,0
WASHROOM METAL SIGN,0
BLACK SWEETHEART BRACELET,3
DIAMANTE HAIR GRIP PACK/2 BLACK DIA,0
BLACK DIAMANTE EXPANDABLE RING,3
DIAMANTE HAIR GRIP PACK/2 RUBY,0
DIAMANTE HAIR GRIP PACK/2 MONTANA,0
BLUE SWEETHEART BRACELET,3
PINK SWEETHEART BRACELET,3
PURPLE SWEETHEART BRACELET,3
RIBBON REEL CHRISTMAS PRESENT ,0
FIRST AID TIN,3
MAKE YOUR OWN MONSOON CARD KIT,2
PACK OF 12 HEARTS DESIGN TISSUES ,4
HEART FILIGREE DOVE LARGE,0
SWIRLY CIRCULAR RUBBERS IN BAG,4
VINTAGE PAISLEY STATIONERY SET,0
SET/10 BLUE POLKADOT PARTY CANDLES,0
RIBBON REEL SOCKS AND MITTENS,0
CHRISTMAS METAL TAGS ASSORTED ,4
CHRISTMAS TREE T-LIGHT HOLDER,0
STAR  T-LIGHT HOLDER ,0
HEART T-LIGHT HOLDER ,0
MINI FUNKY DESIGN TAPES,4
STAR WOODEN CHRISTMAS DECORATION,4
WOODEN HEART CHRISTMAS SCANDINAVIAN,4
CHRISTMAS RETROSPOT TREE WOOD,4
SET/9 CHRISTMAS T-LIGHTS SCENTED ,0
BLUE ROSE FABRIC MIRROR,0
THREE CANVAS LUGGAGE TAGS,2
RETROSPOT PARTY BAG + STICKER SET,0
RETROSPOT SMALL TUBE MATCHES,0
3D CHRISTMAS STAMPS STICKERS ,0
36 FOIL HEART CAKE CASES,2
PACK OF 6 SWEETIE GIFT BOXES,2
CINAMMON SET OF 9 T-LIGHTS,4
ORANGE SCENTED SET/9 T-LIGHTS,4
RIBBON REEL STRIPES DESIGN ,0
SET OF 2 TINS JARDIN DE PROVENCE,3
MAKE YOUR OWN PLAYTIME CARD KIT,2
DINOSAURS  WRITING SET ,0
SKULLS WRITING SET ,0
DOORMAT BLACK FLOCK ,1
CHRISTMAS DECOUPAGE CANDLE,4
OFFICE MUG WARMER POLKADOT,3
BLACK RECORD COVER FRAME,3
"RECORD FRAME 7"" SINGLE SIZE ",2
36 PENCILS TUBE RED RETROSPOT,0
36 PENCILS TUBE WOODLAND,0
ROCKING HORSE RED CHRISTMAS ,4
REGENCY CAKESTAND 3 TIER,1
VINTAGE UNION JACK BUNTING,1
RETRO LONGBOARD IRONING BOARD COVER,0
3D DOG PICTURE PLAYING CARDS,2
SAVE THE PLANET COTTON TOTE BAG,2
PAPER BUNTING WHITE LACE,2
GENTLEMAN SHIRT REPAIR KIT ,4
CARD I LOVE LONDON ,4
MIRRORED WALL ART FOXY,3
MIRRORED WALL ART GENTS,0
AIRLINE BAG VINTAGE JET SET WHITE,3
POTTING SHED SOW 'N' GROW SET,3
AIRLINE BAG VINTAGE WORLD CHAMPION ,3
PINK HEARTS PAPER GARLAND,0
POTTING SHED SEED ENVELOPES,0
HI TEC ALPINE HAND WARMER,0
POLYESTER FILLER PAD 45x45cm,0
CARD DOLLY GIRL ,4
CARD BILLBOARD FONT,4
RAINY LADIES BIRTHDAY CARD,4
RED WHITE SCARF  HOT WATER BOTTLE,3
SET OF 2 TEA TOWELS APPLE AND PEARS,3
LANTERN CREAM GAZEBO ,3
BLUE BIRDHOUSE DECORATION,4
ANTIQUE SILVER TEA GLASS ENGRAVED,0
SET OF 2 WOODEN MARKET CRATES,1
CLASSIC FRENCH STYLE BASKET NATURAL,3
CRAZY DAISY HEART DECORATION,0
CARD HOLDER GINGHAM HEART,2
SMALL STRIPES CHOCOLATE GIFT BAG ,4
"TRAY, BREAKFAST IN BED",1
PIZZA PLATE IN BOX,3
PINK HEART DOTS HOT WATER BOTTLE,3
PLACE SETTING WHITE HEART,4
SET OF 4 NAPKIN CHARMS LEAVES   ,2
SET OF 4 NAPKIN CHARMS STARS   ,2
SET OF 4 NAPKIN CHARMS CUTLERY,2
CARAVAN SQUARE TISSUE BOX,4
BUTTON BOX ,0
12 MESSAGE CARDS WITH ENVELOPES,0
SMALL RED BABUSHKA NOTEBOOK ,4
HERB MARKER MINT,4
HERB MARKER ROSEMARY,4
HERB MARKER BASIL,4
HERB MARKER CHIVES ,4
HERB MARKER PARSLEY,4
HERB MARKER THYME,4
METAL MERRY CHRISTMAS WREATH,0
WHITE CHRISTMAS GARLAND STARS TREES,3
RETROSPOT GIANT TUBE MATCHES,2
36 FOIL STAR CAKE CASES ,0
PACK OF 6 HANDBAG GIFT BOXES,2
GARLAND WOODEN HAPPY EASTER,0
CALENDAR PAPER CUT DESIGN,2
CALENDAR IN SEASON DESIGN,2
BLUE PAISLEY TISSUE BOX,4
PINK PAISLEY SQUARE TISSUE BOX ,4
TOAST ITS - HAPPY BIRTHDAY,0
SET/10 IVORY POLKADOT PARTY CANDLES,0
SKULLS STORAGE BOX SMALL,2
JUMBO STORAGE BAG SKULLS,2
GARDEN PATH JOURNAL,2
BLACK ORANGE SQUEEZER,4
SET OF 72 GREEN PAPER DOILIES,0
RETROSPOT RED WASHING UP GLOVES,2
SMALL LICORICE DES PINK BOWL,4
"SWISS ROLL TOWEL, CHOCOLATE  SPOTS",2
PICNIC BASKET WICKER LARGE,1
CREAM SWEETHEART EGG HOLDER,3
PINK 3 PIECE POLKADOT CUTLERY SET,3
PINK PARTY BAGS,2
BLUE PARTY BAGS ,2
PINK CREAM FELT CRAFT TRINKET BOX ,0
RED RETROSPOT OVEN GLOVE DOUBLE,2
RIDGED GLASS STORAGE JAR CREAM LID,3
PACK OF 20 NAPKINS PANTRY DESIGN,4
SWEETHEART CAKESTAND 3 TIER,1
CHRISTMAS HANGING STAR WITH BELL,4
MULTICOLOUR  CONFETTI IN TUBE,0
CHOCOLATE 3 WICK MORRIS BOX CANDLE,2
SET OF 16 VINTAGE PISTACHIO CUTLERY,1
CHRISTMAS TOILET ROLL,0
WHITE BELL HONEYCOMB PAPER ,0
 4 PURPLE FLOCK DINNER CANDLES,2
PINK & WHITE BREAKFAST TRAY,3
ENGLISH ROSE SPIRIT LEVEL ,0
LARGE ROUND WICKER PLATTER ,1
BLACK TEA TOWEL CLASSIC DESIGN,0
CHRISTMAS LIGHTS 10 VINTAGE BAUBLES,3
ROSES REGENCY TEACUP AND SAUCER ,2
T-LIGHT HOLDER HANGING LACE,4
HANGING HEART MIRROR DECORATION ,4
CREAM SLICE FLANNEL CHOCOLATE SPOT ,2
CREAM SLICE FLANNEL PINK SPOT ,2
GREEN REGENCY TEACUP AND SAUCER,2
EIGHT PIECE DINOSAUR SET,0
HEADS AND TAILS SPORTING FUN,0
ASS COL SMALL SAND GECKO P'WEIGHT,4
ENAMEL MEASURING JUG CREAM,3
12 PENCILS SMALL TUBE SKULL,4
12 PENCIL SMALL TUBE WOODLAND,4
BLUE PAPER PARASOL ,2
VICTORIAN  METAL POSTCARD SPRING,0
METAL 4 HOOK HANGER FRENCH CHATEAU,3
BLACK KITCHEN SCALES,1
RED KITCHEN SCALES,1
IVORY KITCHEN SCALES,1
MULTI COLOUR SILVER T-LIGHT HOLDER,4
3 HOOK HANGER MAGIC GARDEN,0
ASSORTED COLOUR LIZARD SUCTION HOOK,4
JUMBO BAG WOODLAND ANIMALS,2
CHILDREN'S CIRCUS PARADE MUG,0
PACK 3 FIRE ENGINE/CAR PATCHES,0
CARD PSYCHEDELIC APPLES,4
IVORY ENCHANTED FOREST PLACEMAT,0
PACK OF 6 PANNETONE GIFT BOXES,2
MEASURING TAPE BABUSHKA RED,2
RED ENCHANTED FOREST PLACEMAT,0
CHILDRENS DOLLY GIRL MUG,0
TOADSTOOL MONEY BOX,2
MAKE YOUR OWN FLOWERPOWER CARD KIT,2
PAPER CHAIN KIT LONDON,2
MEASURING TAPE BABUSHKA BLUE,2
PENCIL CASE LIFE IS BEAUTIFUL,3
WOODEN ROUNDERS GARDEN SET ,1
CHILDS BREAKFAST SET DOLLY GIRL ,1
CHILDS BREAKFAST SET SPACEBOY ,1
CAKE PLATE LOVEBIRD WHITE,3
WOODEN ADVENT CALENDAR RED,1
GREEN CHRISTMAS TREE CARD HOLDER,2
STRING OF STARS CARD HOLDER,2
SET/12 TAPER CANDLES,4
MINT KITCHEN SCALES,1
WHITE WOOD GARDEN PLANT LADDER,1
GLASS JAR ENGLISH CONFECTIONERY,3
GLASS JAR DIGESTIVE BISCUITS,2
MILK BOTTLE WITH GLASS STOPPER ,1
WELCOME  WOODEN BLOCK LETTERS,1
SET/4 MODERN VINTAGE COTTON NAPKINS,0
VINTAGE UNION JACK APRON,1
SWALLOW SQUARE TISSUE BOX,4
NO JUNK MAIL METAL SIGN,4
SLATE TILE NATURAL HANGING,0
VINTAGE GLASS COFFEE CADDY,1
SILVER GLASS T-LIGHT SET,3
RIDGED GLASS FINGER BOWL,4
GLASS  BEURRE DISH,3
GIN & TONIC DIET GREETING CARD ,4
"BIRTHDAY CARD, RETRO SPOT",4
WRAP RED APPLES ,4
RED RETROSPOT WRAP ,4
WRAP CHRISTMAS SCREEN PRINT,4
FANCY FONTS BIRTHDAY WRAP,4
CLASSIC WHITE FRAME,2
BLACK DINER WALL CLOCK,1
DOORMAT PEACE ON EARTH BLUE,1
BOX OF 24 COCKTAIL PARASOLS,4
GROW YOUR OWN PLANT IN A CAN ,0
PLASTERS IN TIN CIRCUS PARADE ,0
PLASTERS IN TIN STRONGMAN,0
MINI JIGSAW DINOSAUR ,4
MINI JIGSAW BAKE A CAKE ,4
MINI JIGSAW DOLLY GIRL,4
WOODEN SCHOOL COLOURING SET,0
PACK OF 12 TRADITIONAL CRAYONS,4
CARD PARTY GAMES ,4
BOOZE & WOMEN GREETING CARD ,4
PACK OF 12 SUKI TISSUES ,4
PACK OF 12 WOODLAND TISSUES ,4
PACK OF 12 SKULL TISSUES,4
PACK OF 12 BLUE PAISLEY TISSUES ,4
PACK OF 12 CIRCUS PARADE TISSUES ,4
PACK OF 12 SPACEBOY TISSUES,4
LADS ONLY TISSUE BOX,4
RED RETROSPOT TISSUE BOX,4
PACK OF 12 PINK PAISLEY TISSUES ,4
GINGERBREAD MAN COOKIE CUTTER,0
GIN AND TONIC MUG,0
IF YOU CAN'T STAND THE HEAT MUG,0
I CAN ONLY PLEASE ONE PERSON MUG,0
PINK HEART SHAPE EGG FRYING PAN,0
200 RED + WHITE BENDY STRAWS,0
RECIPE BOX RETROSPOT ,2
RECIPE BOX PANTRY YELLOW DESIGN,2
RECIPE BOX BLUE SKETCHBOOK DESIGN,2
20 DOLLY PEGS RETROSPOT,0
NO SINGING METAL SIGN,2
BISCUIT TIN VINTAGE RED,1
EMERGENCY FIRST AID TIN ,0
POLKADOT PEN,4
DECORATIVE PLANT POT WITH FRIEZE,1
FRENCH BLUE METAL DOOR SIGN 5,0
CHEST OF DRAWERS GINGHAM HEART ,1
RED RETROSPOT CAKE STAND,1
JOY WOODEN BLOCK LETTERS,3
NOEL WOODEN BLOCK LETTERS ,1
PEACE WOODEN BLOCK LETTERS,1
OFFICE MUG WARMER BLACK+SILVER ,3
SET OF 2 CHRISTMAS DECOUPAGE CANDLE,4
COSMETIC BAG VINTAGE ROSE PAISLEY,2
PINK ROSE FABRIC MIRROR,0
SILVER PLATE CANDLE BOWL SMALL,2
SMALL REGAL  SILVER CANDLEPOT ,2
ANTIQUE TALL SWIRLGLASS TRINKET POT,3
ANTIQUE GLASS PEDESTAL BOWL,3
GUMBALL MAGAZINE RACK,1
RED FLOWER CROCHET FOOD COVER,3
CHERRY CROCHET FOOD COVER,3
STRAWBERRY RAFFIA FOOD COVER,3
POLKA DOT RAFFIA FOOD COVER,3
DOORMAT SPOTTY HOME SWEET HOME,1
T-LIGHT GLASS FLUTED ANTIQUE,0
SILVER  CANDLEPOT JARDIN ,3
POLKADOT MUG PINK ,0
PAPER BUNTING COLOURED LACE,2
ANTIQUE GLASS HEART DECORATION ,0
SET OF 6 KASHMIR FOLKART BAUBLES,2
CHRISTMAS RETROSPOT ANGEL WOOD,4
CHRISTMAS RETROSPOT STAR WOOD,4
HEART WOODEN CHRISTMAS DECORATION,4
LARGE HANGING IVORY & RED WOOD BIRD,4
SMALL HANGING IVORY/RED WOOD BIRD,4
GRAND CHOCOLATECANDLE,0
FAIRY CAKE BIRTHDAY CANDLE SET,3
3 HOOK PHOTO SHELF ANTIQUE WHITE,1
CREAM SWEETHEART WALL CABINET,1
DOORMAT ENGLISH ROSE ,1
DOORMAT UNION FLAG,1
ROMANTIC IMAGES NOTEBOOK SET,0
CURIOUS  IMAGES NOTEBOOK SET,2
VINTAGE KEEPSAKE BOX PARIS DAYS,1
RED GINGHAM ROSE JEWELLERY BOX,0
BLUE CHARLIE+LOLA PERSONAL DOORSIGN,4
"CHARLIE+LOLA""EXTREMELY BUSY"" SIGN",4
CHARLOTTE BAG SUKI DESIGN,4
LOLITA  DESIGN  COTTON TOTE BAG,2
LETS GO SHOPPING COTTON TOTE BAG,2
PAINT YOUR OWN CANVAS SET,0
CAMOUFLAGE LED TORCH,0
BLUE DRAGONFLY HELICOPTER,1
YELLOW SHARK HELICOPTER,1
RED SHARK HELICOPTER,1
TOOL BOX SOFT TOY ,1
DOCTOR'S BAG SOFT TOY,1
CARRIAGE,1
JUMBO BAG SCANDINAVIAN PAISLEY,0
JUMBO BAG TOYS ,2
PAINTED LIGHTBULB STAR+ MOON,4
BLUE TEA TOWEL CLASSIC DESIGN,0
SET 12 KIDS  WHITE CHALK STICKS,4
CHRISTMAS MUSICAL ZINC STAR,4
CHRISTMAS MUSICAL ZINC HEART ,4
DOVE DECORATION PAINTED ZINC ,4
UNION STRIPE WITH FRINGE  HAMMOCK,1
FOLKART ZINC HEART CHRISTMAS DEC,4
SKULLS AND CROSSBONES WRAP,4
POLYESTER FILLER PAD 45x30cm,0
POLYESTER FILLER PAD 40x40cm,0
PINK FLOWER FABRIC PONY,3
BIRTHDAY PARTY CORDON BARRIER TAPE,0
CAMOUFLAGE DESIGN TEDDY,2
TV DINNER TRAY AIR HOSTESS ,3
SUKI  SHOULDER BAG,0
BLUE SPOT CERAMIC DRAWER KNOB,0
CUSHION COVER PINK UNION JACK,1
CREAM SWEETHEART LETTER RACK,1
FOUR HOOK  WHITE LOVEBIRDS,2
FRENCH BLUE METAL DOOR SIGN 3,0
FRENCH BLUE METAL DOOR SIGN No,0
SET OF 3 BABUSHKA STACKING TINS,3
BEACH HUT KEY CABINET,3
SMALL PURPLE BABUSHKA NOTEBOOK ,4
CHERRY BLOSSOM PASSPORT COVER,0
SMALL YELLOW BABUSHKA NOTEBOOK ,4
RETRO MOD TRAY,4
SWEETHEART WIRE MAGAZINE RACK,1
CARDHOLDER HOLLY WREATH METAL,3
SILVER CHRISTMAS TREE BAUBLE STAND ,1
SWEETHEART RECIPE BOOK STAND,1
OVERNIGHT BAG VINTAGE ROSE PAISLEY,3
ANT WHITE WIRE HEART SPIRAL,3
"FEATHER PEN,COAL BLACK",4
"FEATHER PEN,LIGHT PINK",4
"FEATHER PEN,HOT PINK",4
DOORMAT AIRMAIL ,1
NUMBER TILE COTTAGE GARDEN 8,0
DOORMAT 3 SMILEY CATS,1
BREAD BIN DINER STYLE IVORY,1
BREAD BIN DINER STYLE RED ,1
MAGNETS PACK OF 4 VINTAGE COLLAGE,4
MAGNETS PACK OF 4 HOME SWEET HOME,4
MAGNETS PACK OF 4 CHILDHOOD MEMORY,0
"ART LIGHTS,FUNK MONKEY",2
MINI CAKE STAND WITH HANGING CAKES,0
CERAMIC CAKE STAND + HANGING CAKES,1
SWEETHEART CERAMIC TRINKET BOX,0
SET OF 4 FAIRY CAKE PLACEMATS,3
OFFICE MUG WARMER PINK,2
OFFICE MUG WARMER CHOC+BLUE,3
PLEASE ONE PERSON METAL SIGN,2
GLITTER CHRISTMAS HEART ,4
CIRCUS PARADE CHILDRENS EGG CUP ,0
RED STRIPE CERAMIC DRAWER KNOB,0
"NURSERY A,B,C PAINTED LETTERS",1
SET OF 2 ROUND TINS DUTCH CHEESE,2
GREEN GEISHA GIRL ,3
BLUE GEISHA GIRL ,3
NEWSPAPER STAND,1
CINAMMON & ORANGE WREATH,1
LARGE WHITE HONEYCOMB PAPER BELL  ,2
WOOD STOCKING CHRISTMAS SCANDISPOT,4
SET OF 4 NAPKIN CHARMS HEARTS,2
WOODEN TREE CHRISTMAS SCANDINAVIAN,4
ROCKING HORSE GREEN CHRISTMAS ,4
CHRISTMAS HANGING TREE WITH BELL,4
JINGLE BELLS TREE DECORATION,2
SET OF 4 NAPKIN CHARMS 3 KEYS ,2
SET OF 4 NAPKIN CHARMS INSTRUMENT,2
SET OF 4 NAPKIN CHARMS CROWNS ,2
SWALLOW WOODEN CHRISTMAS DECORATION,4
GLITTER CHRISTMAS TREE,4
GARLAND WITH STARS AND BELLS,3
"CHRISTMAS GARLAND STARS,TREES",3
SWISS CHALET TREE DECORATION ,4
BIRD BOX CHRISTMAS TREE DECORATION,4
WOODEN ADVENT CALENDAR CREAM,1
Manual,1
CARD MOTORBIKE SANTA,4
CARD CHRISTMAS VILLAGE,4
DOORMAT I LOVE LONDON,1
WOOD AND GLASS MEDICINE CABINET,1
MA CAMPAGNE CUTLERY BOX,1
YULETIDE IMAGES GIFT WRAP SET,4
WICKER WREATH LARGE,0
TABLE LAMP WHITE SHADE WOOD BASE,1
SMALL FOLKART STAR CHRISTMAS DEC,4
SMALLFOLKART BAUBLE CHRISTMAS DEC,4
SMALL HANGING GLASS+ZINC LANTERN,0
SET/3 CHRISTMAS DECOUPAGE CANDLES,0
