,categ_product
GLASS SPHERE CANDLE STAND MEDIUM,1
VINTAGE BEAD PINK SHADE ,0
"LETTER ""G"" BLING KEY RING",4
SUNSET COLOUR CHUNKY KNITTED THROW,1
LARGE BLUE PROVENCAL CERAMIC BALL,2
RECTANGULAR SHAPED MIRROR,0
DECORATIVE HANGING SHELVING UNIT,1
BLACK GLASS BRACELET W HEART CHARMS,3
TURQUOISE BERTIE GLASS BEAD CHARM,0
WHITE/PINK CHICK EASTER DECORATION,4
HANGING WOOD AND FELT HEART,4
EASTER CRAFT IVY WREATH WITH CHICK,0
WHITE BEADED GARLAND STRING 20LIGHT,1
STEEL SWEETHEART ROUND TABLE CREAM,1
TEATIME PUSH DOWN RUBBER,4
3 WICK CHRISTMAS BRIAR CANDLE ,3
S/2 ZINC HEART DESIGN PLANTERS,1
CUPID SCENTED CANDLE IN GLASS,0
MAGIC GARDEN FELT GARLAND ,2
WHITE HEART OF GLASS BRACELET,1
PINK HEART OF GLASS BRACELET,1
AMBER GLASS/SILVER BRACELET,1
LONG SILVER NECKLACE PASTEL FLOWER,1
GOLD/M.O.P PENDANT ORBIT NECKLACE,1
SILVER/M.O.P PENDANT ORBIT NECKLACE,1
FLORAL BATHROOM SET,3
GREEN METAL SWINGING BUNNY,4
VINTAGE NOTEBOOK TRAVELOGUE,2
SMALL CHUNKY GLASS ROMAN  BOWL,0
GLASS CHALICE GREEN  LARGE ,0
GOLD TEDDY BEAR,2
BLACK BIRD GARDEN DESIGN MUG,4
15 PINK FLUFFY CHICKS IN BOX,2
ZINC HEART LATTICE TRAY OVAL ,1
SET OF 6 ICE CREAM SKITTLES,2
BLUE CUSHION COVER WITH FLOWER,1
PINK YELLOW PATCH CUSHION COVER,1
A4 WALL TIDY RED FLOWERS,4
PEACH KNITTED HEN ,0
INCENSE BAZAAR PEACH,4
TRANQUILITY MASALA INCENSE,4
OCEAN STRIPE HAMMOCK ,1
VINTAGE SHELLS PRINT,1
ELEPHANT CLIP W SUCTION CUP,4
CHERRY BLOSSOM DECORATIVE FLASK,3
WHITE HYDRANGEA ART FLOWER,2
CREAM CLIMBING HYDRANGA ART FLOWER,2
BLUE STONES ON WIRE FOR CANDLE,4
CANDY HEART HANGING DECORATION,4
GLITTER HEART DECORATION,4
PINK JEWELLED PHOTO FRAME,1
PINK JEWELLED PHOTO FRAME ,3
GINGHAM HEART DECORATION,4
PINK GAUZE BUTTERFLY LAMPSHADE,4
CHERRY BLOSSOM CANVAS ART PICTURE,3
BOTANICAL LAVENDER GIFT WRAP ,4
PINK/PURPLE RETRO RADIO,2
MEDIUM PINK BUDDHA HEAD ,2
"PET MUG, GOLDFISH",4
TINY CRYSTAL BRACELET GREEN,2
NECKLACE+BRACELET PINK BUTTERFLY,2
ICE CREAM DESIGN GARDEN PARASOL,1
SET 2 PANTRY DESIGN TEA TOWELS,3
MINI JIGSAW LEAP FROG,4
METAL RABBIT LADDER EASTER ,4
LUNCH BOX WITH CUTLERY FAIRY CAKES ,2
COTTON APRON PANTRY DESIGN,3
GIRLS ALPHABET IRON ON PATCHES ,4
BOYS ALPHABET IRON ON PATCHES,4
WHITE TRAVEL ALARM CLOCK,2
FLORAL PINK MONSTER,3
CANDY SPOT TEA COSY,2
ICON MUG REVOLUTIONARY,4
"ACRYLIC JEWEL SNOWFLAKE, PINK",4
"POCKET MIRROR ""GLAMOROUS""",0
WHITE ENAMEL FLOWER HAIR TIE,2
GREEN ENAMEL FLOWER HAIR TIE,2
BUTTERFLY HAIR BAND,2
FIRE POLISHED GLASS BRACELET BLACK,3
BLUE MURANO TWIST BRACELET,3
JADE CRYSTAL+GLASS BRACELET,3
RUBY GLASS CLUSTER BRACELET,1
MIDNIGHT BLUE GLASS/SILVER BRACELET,1
PAINTED SEA SHELL METAL WINDCHIME,0
FOLDING SHOE TIDY,2
MADRAS NOTEBOOK MEDIUM,4
SQUARE METAL CANDLEHOLDER BASE,4
ASSORTED TUTTI FRUTTI KEYRING BALL,4
M/COLOUR POM-POM CURTAIN,3
BLACK CHERRY LIGHTS,1
CRACKED GLAZE EARRINGS BROWN,2
BLACK VINTAGE  CRYSTAL EARRINGS,3
BLACK CRYSTAL DROP EARRINGS,2
WHITE VINTAGE CRYSTAL EARRINGS,3
WHITE VINT ART DECO CRYSTAL NECKLAC,1
BLACK VINT ART DEC CRYSTAL NECKLACE,1
NEW BAROQUE SMALL NECKLACE BLACK,1
SWEETHEART CARRY-ALL BASKET,1
LILAC GAUZE BUTTERFLY LAMPSHADE,4
PINK/PURPLE CIRCLE CURTAIN,0
GIANT MEDINA STAMPED METAL BOWL ,1
PINK FLOWERS RABBIT EASTER,2
PURPLE AMETHYST NECKLACE W TASSEL,1
BLUE/NAT SHELL NECKLACE W PENDANT,1
SILVER/NAT SHELL NECKLACE W PENDANT,1
SILVER M.O.P ORBIT DROP EARRINGS,3
FILIGREE DIAMANTE EARRINGS,3
JADE DROP EARRINGS W FILIGREE,3
GRASS HOPPER WOODEN WALL CLOCK ,2
IVORY STRING CURTAIN WITH POLE ,2
PINK SQUARE TABLE CLOCK,0
PINK MONTE CARLO HANDBAG,2
PINK DISCO HANDBAG,2
MUSICAL ZINC HEART DECORATION ,4
RETROSPOT WOODEN HEART DECORATION,4
HANGING METAL CHICKEN DECORATION,0
PANTRY SCRUBBING BRUSH,0
HANGING HEART WITH BELL,4
SET OF 4 PANTRY JELLY MOULDS,0
TRAVEL CARD WALLET FLOWER MEADOW,4
TRAVEL CARD WALLET PANTRY,4
TRAVEL CARD WALLET SKULLS,4
TRAVEL CARD WALLET VINTAGE ROSE ,4
TRAVEL CARD WALLET TRANSPORT,4
TRAVEL CARD WALLET RETROSPOT,4
TRAVEL CARD WALLET KEEP CALM,4
GIRAFFE WOODEN RULER,2
REVOLVER WOODEN RULER ,0
POTTING SHED ROSE CANDLE,3
"RETRO PILL BOX , REVOLUTIONARY",4
TRAVEL CARD WALLET RETRO PETALS,4
TRAVEL CARD WALLET SUKI,4
TRAVEL CARD WALLET VINTAGE TICKET,4
PANTRY ROLLING PIN,3
TRAVEL CARD WALLET UNION JACK,4
TRAVEL CARD WALLET I LOVE LONDON,4
"RETRO TIN ASHTRAY,REVOLUTIONARY",4
FRENCH FLORAL CUSHION COVER ,4
FUSCHIA TABLE RUN FLOWER ,0
DOTCOMGIFTSHOP TEA TOWEL,0
CHILDRENS CUTLERY POLKADOT BLUE,3
CHILDRENS CUTLERY POLKADOT PINK,3
S/3 PINK SQUARE PLANTERS ROSES,1
PURPLE/COPPER HANGING LAMPSHADE,4
BLUE WHITE PLASTIC RINGS LAMPSHADE,4
GOLD M.O.P ORBIT DROP EARRINGS,3
WHITE VINTAGE CRYSTAL BRACELET,1
SILVER LARIAT 40CM,1
NEW BAROQUE B'FLY NECKLACE CRYSTAL,1
GLASS BEAD HOOP NECKLACE AMETHYST,1
SILVER BRACELET W PASTEL FLOWER,1
NEW BAROQUE B'FLY NECKLACE GREEN,1
MIDNIGHT BLUE COPPER FLOWER NECKLAC,1
COPPER/OLIVE GREEN FLOWER NECKLACE,1
RASPBERRY ANT COPPER FLOWER NECKLAC,1
GLASS BEAD HOOP NECKLACE GREEN,1
GLASS BEAD HOOP NECKLACE MONTANA,1
PINK AND BLACK STRING CURTAIN,3
PACK 20 DOLLY PEGS,4
SWISS ROLL TOWEL PINK  SPOTS,3
LUNCH BAG SUKI DESIGN ,0
CHILDRENS CUTLERY RETROSPOT RED ,3
CHILDRENS CUTLERY POLKADOT GREEN ,3
GREEN ENAMEL+GLASS HAIR COMB,2
GREEN HEART COMPACT MIRROR,0
WOVEN BERRIES CUSHION COVER ,3
T-LIGHT HOLDER WHITE LACE,4
SCALLOP SHELL SOAP DISH,2
HEART BUTTONS JEWELLERY BOX,1
PINK STRING CURTAIN WITH POLE,2
TOP SECRET PEN SET,0
"LETTER ""A"" BLING KEY RING",0
NECKLACE+BRACELET SET PINK DAISY,2
NECKLACE+BRACELET SET BLUE BLOSSOM,2
SET/6 POSIES PAPER CUPS,4
JUMBO BAG SCANDINAVIAN BLUE PAISLEY,2
PINK CHRYSANTHEMUMS ART FLOWER,2
STARFISH SOAP DISH,2
PINK RIVIERA HANDBAG,3
BEST DAD CANDLE LETTERS,4
GROOVY CACTUS INFLATABLE,4
HEAVENS SCENT FRAGRANCE OILS ASSTD,4
SMALL SINGLE FLAME CANDLE HOLDER,4
PINK FELT HANGING HEART W FLOWER,4
BEACH HUT SHELF W 3 DRAWERS,1
FUNKY MONKEY CUSHION COVER,4
PURPLE ANEMONE ARTIFICIAL FLOWER,0
WHITE ALLIUM  ARTIFICIAL FLOWER,0
PINK FOXGLOVE ARTIIFCIAL FLOWER,2
MIRRORED DOVE WALL DECORATION,2
TOILET SIGN OCCUPIED OR VACANT,4
SMALL BLUE PROVENCAL CERAMIC BALL,0
PANTRY WASHING UP BRUSH,0
TREASURE ISLAND BOOK BOX,2
BUFFALO BILL TREASURE BOOK BOX,2
GYMKHANNA TREASURE BOOK BOX,2
ABC TREASURE BOOK BOX ,2
PANTRY PASTRY BRUSH,0
DOLLCRAFT GIRL AMELIE KIT,3
DOLLCRAFT GIRL NICOLE,3
CLEAR STATIONERY BOX SET ,4
FELTCRAFT GIRL NICOLE KIT,3
WOVEN FROST CUSHION COVER,3
FELTCRAFT BOY JEAN-PAUL KIT,3
FELTCRAFT GIRL AMELIE KIT,1
GYMKHANA TREASURE BOOK BOX,2
MOTHER'S KITCHEN SPOON REST ,3
CLOCK MAGNET MUM'S KITCHEN,2
JAM CLOCK MAGNET,2
PANTRY APPLE CORER,0
PINK & WHITE ROSEBUD RING,3
WHITE WITH BLACK CATS PLATE,4
MUM'S KITCHEN CLOCK,3
ASSORTED MINI MADRAS NOTEBOOK,4
TURQ PENDANT TRIPLE SHELL NECKLACE,3
GREEN PENDANT TRIPLE SHELL NECKLACE,3
BLACK DROP EARRINGS W LONG BEADS,2
BLUE MURANO TWIST NECKLACE,1
RECYCLED ACAPULCO MAT RED,1
RECYCLED ACAPULCO MAT PINK,1
RECYCLED ACAPULCO MAT LAVENDER,1
RECYCLED ACAPULCO MAT GREEN,1
RECYCLED ACAPULCO MAT TURQUOISE,1
RECYCLED ACAPULCO MAT BLUE,1
"S/4 ICON COASTER,ELVIS LIVES",4
DOLLCRAFT BOY JEAN-PAUL ,3
FRENCH STYLE STORAGE JAR JAM,4
BULL DOG BOTTLE OPENER,1
PINK CRYSTAL GUITAR PHONE CHARM,4
BLACK FEATHER CHRISTMAS DECORATION,4
PURPLE FOXGLOVE ARTIIFCIAL FLOWER,2
MURANO STYLE GLASS BRACELET GOLD,3
GLASS AND PAINTED BEADS BRACELET OL,3
GLASS AND BEADS BRACELET IVORY,3
"LETTER ""P"" BLING KEY RING",4
MIRRORED WALL ART SPLODGES,0
YELLOW FELT HANGING HEART W FLOWER,4
PURPLE/TURQ FLOWERS HANDBAG,0
CROCHET ROSE DES CLOTHES HANGER,2
BLUE HOLE PUNCH,0
BABY MOUSE RED GINGHAM DRESS,3
BULL DOG BOTTLE TOP WALL CLOCK,1
FRENCH STYLE STORAGE JAR BONBONS,4
DOLLCRAFT GIRL AMELIE,3
FRENCH STYLE STORAGE JAR CAFE ,4
"RUSTIC WOODEN CABINET, GLASS DOORS",1
YELLOW/BLUE RETRO RADIO,2
"RETRO PILL BOX KEY CHAIN,THE KING",4
I LOVE LONDON BABY GIFT SET,1
 SPACEBOY BABY GIFT SET,1
DOLLY GIRL BABY GIFT SET,1
CANDY SPOT HAND BAG,2
CIRCUS PARADE BABY GIFT SET,1
CHERRY BLOSSOM LUGGAGE TAG,0
ENGLISH ROSE NOTEBOOK A6 SIZE,4
PASTEL PINK PHOTO ALBUM ,4
RED  EGG  SPOON,4
HELLO SAILOR BATHROOM SET,3
BLUE GLASS GEMS IN BAG,4
HEN HOUSE W CHICK IN NEST,4
WRAP BAD HAIR DAY,4
BLACK ENAMEL FLOWER RING,2
ACRYLIC GEOMETRIC LAMP,1
PIECE OF CAMO STATIONERY SET,4
WINE BOTTLE DRESSING LT.BLUE,4
SET OF 16 VINTAGE IVORY CUTLERY,1
LARGE SKULL WINDMILL,2
WOVEN CANDY CUSHION COVER ,3
JUNGLE POPSICLES ICE LOLLY MOULDS,0
PINK SMALL GLASS CAKE STAND,0
FLAG OF ST GEORGE CHAIR,1
BLUE POLKADOT BEAKER ,4
ANTIQUE SILVER T-LIGHT GLASS,0
ORANGE FLOWER MUG ,4
YELLOW PINK FLOWER DESIGN BIG BOWL,4
FRENCH CHATEAU OVAL PLATTER,0
ASSORTED SANSKRIT MINI NOTEBOOK,0
BLUE FLOWER DES PURSE,4
ELVIS WALLHANGING / CURTAIN,0
BIG POLKADOT MUG,4
"FLOWER GLASS GARLD NECKL36""TURQUOIS",1
RED KUKUI COCONUT SEED NECKLACE,0
PINK/AMETHYST/GOLD NECKLACE,1
ASSORTED COLOUR SILK GLASSES CASE,2
DOUGHNUT LIP GLOSS ,0
ICE CREAM SUNDAE LIP GLOSS,0
ICE CREAM PEN LIP GLOSS ,0
OPEN CLOSED METAL SIGN,3
WINE BOTTLE DRESSING DARK BLUE,4
CROCHET BEAR RED/BLUE  KEYRING,0
PINK HAWAIIAN PICNIC HAMPER FOR 2,1
FAN BLACK FRAME ,4
POTTING SHED CANDLE CITRONELLA,2
WRAP BILLBOARD FONTS DESIGN,4
SET OF 5 PANCAKE DAY MAGNETS,2
SET OF 4 JAM JAR MAGNETS,2
SET OF 5 MINI GROCERY MAGNETS,2
KNICKERBOCKERGLORY MAGNET ASSORTED ,4
PACK 4 FLOWER/BUTTERFLY PATCHES,0
SET OF 5 LUCKY CAT MAGNETS ,2
JARDIN ETCHED GLASS LARGE BELL JAR,1
MUMMY MOUSE RED GINGHAM RIBBON,1
FRENCH CHATEAU SMALL FRUITBOWL,2
FRENCH CHATEAU LARGE FRUIT BOWL ,0
ANTIQUE CREAM CUTLERY CUPBOARD,1
ENVELOPE 50 ROMANTIC IMAGES,4
PINK ROSEBUD PEARL BRACELET,3
PINK MURANO TWIST NECKLACE,1
GREEN MURANO TWIST NECKLACE,1
GREEN  DIAMANTE PEN IN GIFT BOX,3
WRAP CAROUSEL,4
NECKLACE+BRACELET SET BLUE HIBISCUS,2
ORANGE FELT VASE + FLOWERS,0
SET OF 6 NATIVITY MAGNETS ,2
SILVER/BLACK ORBIT NECKLACE,1
VINTAGE BEAD COSMETIC BAG ,3
ENAMEL BLUE RIM TEA CONTAINER,0
BEACH HUT MIRROR,2
MIRROR MOSAIC CANDLE PLATE,0
HEN HOUSE WITH CHICK STANDING,4
BLACK PHOTO ALBUM ,4
TUMBLER BAROQUE,4
GOLDIE LOOKING MIRROR,3
PINK ROUND COMPACT MIRROR,0
BLUE SQUARE COMPACT MIRROR,0
MIRROR MOSAIC HURRICANE LAMP ,1
DECORATION WOBBLY CHICKEN,4
DECORATION WOBBLY RABBIT METAL ,4
TEATIME FUNKY FLOWER BACKPACK FOR 2,1
CHILDRENS CUTLERY DOLLY GIRL ,3
CHILDRENS CUTLERY SPACEBOY ,3
NEW BAROQUE B'FLY NECKLACE PINK,1
CHILDRENS CUTLERY CIRCUS PARADE,3
TUMBLER NEW ENGLAND,4
BOTANICAL LILY GIFT WRAP,4
ANTIQUE OPAL WHITE FLOWER EARRINGS,3
BAROQUE BUTTERFLY EARRINGS BLACK,3
MOP PENDANT SHELL NECKLACE,3
YELLOW/ORANGE FLOWER DESIGN PLATE,4
CHARLOTTE BAG VINTAGE ALPHABET ,4
JUMBO BAG ALPHABET,2
LUNCH BAG ALPHABET DESIGN,0
JUMBO BAG APPLES,2
LUNCH BAG APPLE DESIGN,0
CHARLOTTE BAG APPLES DESIGN,4
CHARLOTTE BAG ALPHABET  DESIGN,4
KIDS CUTLERY SPACEBOY ,3
KIDS CUTLERY DOLLY GIRL ,3
LUNCH BAG VINTAGE LEAF DESIGN,0
HARDMAN MUG 3 ASSORTED,4
S/2 BEACH HUT TREASURE CHESTS,3
BLUE PADDED SOFT MOBILE,3
PINK FEATHERS CURTAIN,4
WOVEN BUBBLE GUM CUSHION COVER,3
WOVEN ROSE GARDEN CUSHION COVER ,3
WOVEN SUNSET CUSHION COVER ,3
PADS TO MATCH ALL CUSHIONS,4
SQUARECUSHION COVER PINK UNION JACK,1
3 BIRDS CANVAS SCREEN,0
LARGE DECO JEWELLERY STAND,1
PASTEL BLUE PHOTO ALBUM ,4
HEART BEADED TRELLIS DECORATION,2
GEMSTONE CHANDELIER T-LIGHT HOLDER,3
BEADED CHANDELIER T-LIGHT HOLDER,3
SMALL DECO JEWELLERY STAND,1
ALUMINIUM STAMPED HEART,2
DOUBLE CERAMIC PARLOUR HOOK,3
ZINC SWEETHEART WIRE LETTER RACK,3
PARLOUR CERAMIC WALL HOOK,3
GEORGIAN TRINKET BOX,1
CROCHET WHITE RABBIT KEYRING ,0
SET OF 12 ROSE BOTANICAL T-LIGHTS,2
BLUE CAT BISCUIT BARREL PINK HEART,0
TRIPLE HOOK ANTIQUE IVORY ROSE,3
VINTAGE EMBOSSED HEART,0
GOLD WINE GOBLET,4
GOLD APERITIF GLASS,4
IVORY CHANDELIER T-LIGHT HOLDER,1
FLOWERS CHANDELIER T-LIGHT HOLDER,1
TRIPLE WIRE HOOK IVORY HEART,3
TRIPLE WIRE HOOK PINK HEART,3
SMALL ZINC HEART WALL ORGANISER,1
SMALL IVORY HEART WALL ORGANISER,1
MARIE ANTOIENETT TRINKET BOX GOLD,1
IVORY SWEETHEART WIRE LETTER RACK ,3
LARGE ZINC HEART WALL ORGANISER,1
LARGE IVORY HEART WALL ORGANISER,1
60 GOLD AND SILVER FAIRY CAKE CASES,4
SINGLE ANTIQUE ROSE HOOK IVORY,0
MINIATURE ANTIQUE ROSE HOOK IVORY,4
ZINC T-LIGHT HOLDER STARS SMALL,4
IVORY WIRE KITCHEN ORGANISER,1
IVORY WIRE SWEETHEART LETTER TRAY,3
SINGLE WIRE HOOK PINK HEART,0
SINGLE WIRE HOOK IVORY HEART,0
IVORY SWEETHEART SOAP DISH,2
ZINC T-LIGHT HOLDER STAR LARGE,4
16 PIECE CUTLERY SET PANTRY DESIGN,1
PINK BUTTERFLY CUSHION COVER,0
ZINC WIRE SWEETHEART LETTER TRAY,3
PAINTED LIGHTBULB RAINBOW DESIGN,4
LILAC VOTIVE CANDLE,4
TEATIME GEL PENS ASST,4
ORANGE/WHT/FUSCHIA STONES NECKLACE,3
WHITE/PINK MINI CRYSTALS NECKLACE,3
COTE D'AZURE NECKLACE,3
WHITE  ROSEBUD PEARL BRACELET,2
PINK ROSEBUD & PEARL NECKLACE,1
WHITE ROSEBUD & PEARL NECKLACE,1
ST TROPEZ NECKLACE,3
RIVIERA NECKLACE,3
CRACKED GLAZE NECKLACE RED,1
EDWARDIAN PHOTO FRAME,1
MAXWELL 2 TONE BLUE 60 PAGE PHOTO A,0
MISTLETOE HEART WREATH CREAM,3
HANGING ENGRAVED METAL HEART,3
BLUE TABLE RUN FLOWER,0
BLUE STRIPES SHOULDER BAG,4
BLUE CHECK BAG W HANDLE 34X20CM,4
LASER CUT MULTI STRAND NECKLACE,1
REGENCY SUGAR TONGS,2
DOORMAT KEEP CALM AND COME IN,1
DOORMAT VINTAGE LEAVES DESIGN ,1
GREEN ENAMEL FLOWER RING,2
RED ENAMEL FLOWER RING,2
PURPLE ENAMEL FLOWER RING,2
CD WALL TIDY BLUE OFFICE,4
REGENCY TEA STRAINER,3
SMALL ZINC/GLASS CANDLEHOLDER,0
GOLD FLOWER CUSHION COVER ,0
SET OF 10 LANTERNS FAIRY LIGHT STAR,3
PAPER LANTERN 7 POINT SNOW STAR,1
PAPER LANTERN 9 POINT SNOW STAR,3
PAPER LANTERN 9 POINT SNOW STAR ,1
CINDERELLA CHANDELIER ,1
BLING KEY RING STAND,0
MISTLETOE HEART WREATH GREEN,3
WHITE 3 FRAME BIRDS AND TREE ,1
FRENCH LATTICE CUSHION COVER ,4
WRAP SUMMER ROSE DESIGN,4
FRENCH PAISLEY CUSHION COVER,4
REGENCY TEA SPOON,0
REGENCY CAKE FORK,0
REGENCY CAKE SLICE,3
ANTIQUE IVORY WIRE BOWL SMALL,2
MINITURE ANTIQUE ROSE HOOK IVORY,4
PINK FLOCK PHOTO FRAME ,0
ZINC WIRE KITCHEN ORGANISER,1
FOOD COVER WITH BEADS SET 2 ,3
SPOTTY BUNTING,3
EDWARDIAN HEART PHOTO FRAME,3
ZINC SWEETHEART SOAP DISH,0
CRYSTAL STUD EARRINGS CLEAR DISPLAY,4
PAPER LANTERN 9 POINT HOLLY STAR 40,1
PAPER LANTERN 5 POINT STAR MOON 30,3
PAPER LANTERN 6 POINT SNOW STAR,3
PINK AND WHITE CHRISTMAS TREE 120CM,2
"BUNTING , SPOTTY ",3
POLYESTER FILLER PAD 60x40cm,2
BLUE DISCO HANDBAG,2
LUNCH BAG DOILEY PATTERN ,0
JUMBO BAG PEARS,2
JUMBO BAG DOILEY PATTERNS,2
MONTANA DIAMOND CLUSTER EARRINGS,2
MARIE ANTOINETTE TRINKET BOX GOLD,1
MARIE ANTOINETTE TRINKET BOX SILVER,1
JUMBO BAG VINTAGE LEAF,2
PAPER LANTERN 9 POINT HOLLY STAR L,1
PAPER LANTERN 9 POINT DELUXE STAR,1
PAPER LANTERN 5 POINT SEQUIN STAR,1
PAPER LANTERN 9 POINT HOLLY STAR S,3
PAPER LANTERN 9 POINT HOLLY STAR 23,3
PAPER LANTERN 5 POINT STUDDED STAR,1
"FOOD COVER WITH BEADS , SET 2 SIZES",3
RASTA IN BATH W SPLIFF ASHTRAY,4
FLOWER GARLAND NECKLACE RED,1
IVORY SHELL HEART EARRINGS,2
TURQ STONE/CRYSTAL EARRINGS,2
"FLOWER GLASS GARLAND NECKL.36""BLUE",1
FOLDING BUTTERFLY MIRROR IVORY ,4
FOLDING BUTTERFLY MIRROR HOT PINK ,4
BUNDLE OF 3 SCHOOL EXERCISE BOOKS  ,0
BUNDLE OF 3 RETRO NOTE BOOKS,0
GREEN GOOSE FEATHER TREE 60CM,0
PINK GOOSE FEATHER TREE 60CM,0
WHITE GOOSE FEATHER TREE 60CM ,0
BUNDLE OF 3 RETRO EXERCISE BOOKS,0
REGENCY MILK JUG PINK ,3
REGENCY SUGAR BOWL GREEN,3
REGENCY TEAPOT ROSES ,1
REGENCY TEA PLATE PINK,0
REGENCY TEA PLATE GREEN ,0
REGENCY TEA PLATE ROSES ,0
GREEN METAL BOX ARMY SUPPLIES,1
RABBIT NIGHT LIGHT,2
FOLDING BUTTERFLY MIRROR RED  ,4
PARISIENNE JEWELLERY DRAWER ,1
PETIT TRAY CHIC,0
ZINC HERB GARDEN CONTAINER,1
LE GRAND TRAY CHIC SET,1
SET OF 10 LED DOLLY LIGHTS,1
RED METAL BOX TOP SECRET,1
GREEN METAL BOX TOP SECRET,1
PARISIENNE KEY CABINET ,1
BUNDLE OF 3 ALPHABET EXERCISE BOOKS,0
SILVER BELLS TABLE DECORATION,0
SILVER HEARTS TABLE DECORATION,4
VINTAGE ENGRAVED HEART,0
SET 6 PAPER TABLE LANTERN HEARTS ,3
FLOWERS HANDBAG blue and orange,0
SMALL PARISIENNE HEART PHOTO FRAME ,2
FOLDING MIRROR HOT PINK ,4
LED TEA LIGHTS,2
BELL HEART DECORATION,0
ALUMINIUM HEART,2
CRYSTAL CHANDELIER T-LIGHT HOLDER,1
PARISIENNE CURIO CABINET,1
PARISIENNE SEWING BOX,1
TOADSTOOL BEDSIDE LIGHT ,1
SMALL CERAMIC TOP STORAGE JAR ,4
IVORY PANTRY HANGING LAMP ,1
CLASSIC SUGAR DISPENSER,0
LARGE ZINC GLASS CANDLEHOLDER,3
MISELTOE HEART WREATH WHITE,3
MISELTOE HEART WREATH ,3
CLASSIC GLASS SWEET JAR,3
LARGE CERAMIC TOP STORAGE JAR,0
LARGE JEWELLERY STAND,1
SMALL JEWELLERY STAND,1
SILVER STARS TABLE DECORATION,4
GLASS BON BON JAR,0
WHITE WIRE PLANT POT HOLDER,2
CLASSIC GLASS COOKIE JAR,3
FIRE POLISHED GLASS BRACELET GREEN,3
FIRE POLISHED GLASS BRACELET MONTAN,3
FIRE POLISHED GLASS BRACELET RED,3
CLASSIC CAFE SUGAR DISPENSER,0
JINGLE BELL HEART DECORATION,0
ZINC HEARTS PLANT POT HOLDER,2
WHITE HEARTS WIRE PLANT POT HOLDER,2
ZINC  HEART T-LIGHT HOLDER,0
ZINC HEART FLOWER T-LIGHT HOLDER,0
METAL HERB GERDEN CONTAINER,1
ZINC PLANT POT HOLDER,2
FOLDING MIRROR IVORY ,4
FOLDING MIRROR RED  ,4
"PEARL & SHELL 42""NECKL. IVORY",1
GARDENERS KNEELING PAD KEEP CALM ,0
GARDENERS KNEELING PAD CUP OF TEA ,0
KNEELING MAT HOUSEWORK  DESIGN,0
ENGLISH ROSE SCENTED HANGING HEART,3
VINTAGE GLASS T-LIGHT HOLDER,4
SET 6 PAPER TABLE LANTERN STARS ,3
LARGE ANTIQUE WHITE PHOTO FRAME,1
ANTIQUE SILVER BAUBLE LAMP  ,1
FRENCH CARRIAGE LANTERN,1
ZINC  STAR T-LIGHT HOLDER ,0
WHITE SQUARE TABLE CLOCK,2
"LETTER ""Y"" BLING KEY RING",4
FUNKY FLOWER PICNIC BAG FOR 4,1
DARK BIRD HOUSE TREE DECORATION,4
MULTICOLOUR POLKADOT PLATE,4
SET 10 NIGHT OWL LIGHTS,1
HEART SHAPED HOLLY WREATH,3
BLUE DELPHINIUM ARTIFICIAL FLOWER,2
IVORY CAFE HANGING LAMP ,1
PINK ENAMEL FLOWER HAIR TIE,2
RED PEONY CUSHION COVER ,3
GREEN PEONY CUSHION COVER,3
CLEAR CRYSTAL STAR PHONE CHARM,4
CRYSTAL STILETTO PHONE CHARM,4
SILVER FLOWR PINK SHELL NECKLACE,1
SILVER DROP EARRINGS WITH FLOWER,3
GREEN VINTAGE EARRINGS ,3
CRACKED GLAZE NECKLACE IVORY,1
IVORY PENDANT TRIPLE SHELL NECKLACE,3
ZINC T-LIGHT HOLDER STARS LARGE,4
16 PC CUTLERY SET PANTRY DESIGN,1
CAPIZ CHANDELIER,1
PEARL AND CHERRY QUARTZ BRACLET,3
FILIGREE HEART BIRD WHITE ,0
FILIGREE HEART BUTTERFLY WHITE ,0
ZINC STAR T-LIGHT HOLDER ,0
AMBER BERTIE GLASS BEAD BAG CHARM,2
Next Day Carriage,1
DECORATION SITTING BUNNY,4
CHERRY BLOSSOM PURSE,2
FILIGREE HEART DAISY WHITE,0
PINK OVAL SHAPE TRINKET BOX,1
CHAMPAGNE TRAY BLANK CARD,4
JINGLE BELL HEART ANTIQUE GOLD,2
JINGLE BELL HEART ANTIQUE SILVER,2
DIAMANTE HAIR GRIP PACK/2 LT ROSE,0
PAIR OF PINK FLOWER CLUSTER SLIDE,2
WHITE ROCKING HORSE HAND PAINTED,0
STAR WREATH DECORATION WITH BELL,0
HEART WREATH DECORATION WITH BELL,0
LAUREL STAR ANTIQUE SILVER ,0
CHERUB HEART DECORATION GOLD,4
REINDEER HEART DECORATION SILVER,4
RED ROCKING HORSE HAND PAINTED,0
LAUREL HEART ANTIQUE GOLD,0
LAUREL HEART ANTIQUE SILVER,0
CHERUB HEART DECORATION SILVER ,4
SET 2 TEA TOWELS I LOVE LONDON ,3
SET OF 3 HANGING OWLS OLLIE BEAK,0
SET OF 3 WOODEN HEART DECORATIONS,0
PAPER LANTERN 5 POINT STAR MOON ,3
SET OF 60 I LOVE LONDON CAKE CASES ,4
SET OF 6 HALLOWEEN GHOST T-LIGHTS,4
SET OF 2 CERAMIC PAINTED HEARTS ,0
CRYSTAL DIAMANTE STAR BROOCH,3
GOLD DIAMANTE STAR BROOCH,3
PINK/BLUE DISC/MIRROR STRING,4
SET OF 60 PANTRY DESIGN CAKE CASES ,4
SET OF 36 DOILIES PANTRY DESIGN,0
SET OF 60 VINTAGE LEAF CAKE CASES ,4
HEART T-LIGHT HOLDER WILLIE WINKIE,0
STAR T-LIGHT HOLDER WILLIE WINKIE,0
SET 4 VALENTINE DECOUPAGE HEART BOX,3
"ACRYLIC JEWEL ICICLE, PINK",4
WRAP GINGHAM ROSE ,4
MIRRORED WALL ART SNOWFLAKES,4
POP ART PUSH DOWN RUBBER ,4
"LETTER ""E"" BLING KEY RING",4
WHITE FRANGIPANI HAIR CLIP,4
SET OF 4 KNICK KNACK TINS DOILEY ,3
SET OF 4 KNICK KNACK TINS LONDON ,3
SET OF TEA COFFEE SUGAR TINS PANTRY,3
BLACK SQUARE TABLE CLOCK,2
PINK FLOCK SUEDE CUSHION COVER ,0
SET OF 3 REGENCY CAKE TINS,3
SET OF 4 KNICK KNACK TINS POPPIES,3
DOILEY STORAGE TIN,2
STORAGE TIN VINTAGE LEAF,2
TREASURE TIN GYMKHANA DESIGN,2
TREASURE TIN BUFFALO BILL ,2
BISCUIT TIN 50'S CHRISTMAS,2
ROUND STORAGE TIN VINTAGE LEAF,0
SET OF 4 KNICK KNACK TINS LEAVES ,3
36 DOILIES VINTAGE CHRISTMAS,0
FOLKART CHRISTMAS TREE T-LIGHT HOLD,4
SMALL WHITE HEART OF WICKER,0
DOILEY BISCUIT TIN,2
BUBBLEGUM RING ASSORTED,4
"LETTER ""L"" BLING KEY RING",4
"LETTER ""N"" BLING KEY RING",4
"LETTER ""H"" BLING KEY RING",4
REINDEER HEART DECORATION GOLD,4
FRUIT SALAD BAG CHARM,0
DANISH ROSE UMBRELLA STAND,1
THE KING GIFT BAG,4
PICNIC BASKET WICKER 60 PIECES,1
ZINC FOLKART SLEIGH BELLS,0
SET OF 3 WOODEN STOCKING DECORATION,0
SET OF 3 WOODEN TREE DECORATIONS,0
SET OF 3 WOODEN SLEIGH DECORATIONS,0
SET OF 2 CERAMIC CHRISTMAS TREES,0
SET OF 2 CERAMIC CHRISTMAS REINDEER,0
VINTAGE RED ENAMEL TRIM JUG ,3
LARGE WHITE HEART OF WICKER,2
POPCORN HOLDER,4
DOLPHIN WINDMILL,2
BLUE VINTAGE SPOT BEAKER,4
EGG FRYING PAN RED ,2
PINK VINTAGE SPOT BEAKER,4
GREEN VINTAGE SPOT BEAKER,4
VINTAGE KEEPSAKE BOX PINK FLOWER,1
JUMBO BAG VINTAGE CHRISTMAS ,2
SMALL POP BOX FUNKY MONKEY,0
CHRISTMAS STAR WISH LIST CHALKBOARD,0
GLASS BEAD HOOP NECKLACE BLACK,1
"FLOWER GLASS GARLAND NECKL.36""GREEN",1
VINTAGE ENAMEL & CRYSTAL NECKLACE,3
ANTIQUE RASPBERRY FLOWER EARRINGS,3
ANTIQUE OLIVE GREEN FLOWER EARRINGS,3
ANTIQUE MID BLUE FLOWER EARRINGS,3
GOLD/AMBER DROP EARRINGS W LEAF,2
SILVER/CRYSTAL DROP EARRINGS W LEAF,2
GREEN DROP EARRINGS W BEAD CLUSTER,3
CHRISTMAS TABLE CANDLE SILVER SPIKE,4
EGG FRYING PAN IVORY ,2
EGG FRYING PAN BLUE ,2
EGG FRYING PAN PINK ,2
EGG FRYING PAN MINT ,2
SPACE BOY CHILDRENS CUP,0
DOLLY GIRL CHILDRENS CUP,0
DOLLY GIRL CHILDRENS BOWL,0
SPACEBOY CHILDRENS BOWL,0
RED VINTAGE SPOT BEAKER,4
ROSE DU SUD CUSHION COVER ,3
VINTAGE  2 METER FOLDING RULER,0
BISCUIT TIN VINTAGE LEAF,2
CANNISTER VINTAGE LEAF DESIGN,0
VINTAGE RED ENAMEL TRIM MUG ,0
VINTAGE RED ENAMEL TRIM PLATE,0
VINTAGE RED TRIM ENAMEL BOWL ,0
VINTAGE DONKEY TAIL GAME ,3
BISCUIT TIN VINTAGE CHRISTMAS,2
GLASS APOTHECARY BOTTLE PERFUME,3
GLASS APOTHECARY BOTTLE ELIXIR,3
DRAWER KNOB CERAMIC IVORY,0
CROCHET DOG KEYRING,0
GLASS  SONGBIRD STORAGE JAR,1
DRAWER KNOB CRACKLE GLAZE IVORY,0
DRAWER KNOB CRACKLE GLAZE BLUE,0
DRAWER KNOB CRACKLE GLAZE PINK,0
DRAWER KNOB CRACKLE GLAZE GREEN,0
DRAWER KNOB CERAMIC RED,0
DRAWER KNOB CERAMIC BLACK,0
GLASS APOTHECARY BOTTLE TONIC,3
DONKEY TAIL GAME ,3
TRANSPARENT ACRYLIC TAPE DISPENSER,0
 TOADSTOOL BEDSIDE LIGHT ,1
JUMBO BAG 50'S CHRISTMAS ,2
GOLD FABRIC MIRROR,4
DOORKNOB CRACKED GLAZE IVORY,0
DOORKNOB CRACKED GLAZE BLUE,0
SMALL BONNE JAM JAR  T-LIGHT HOLDER,2
GLASS TWIST BON BON JAR,1
DRAWER KNOB VINTAGE GLASS STAR,2
PACK OF 6 LARGE FRUIT STRAWS ,4
SPACEBOY CHILDRENS CUP,0
COCKTAIL SWORDS 50 PIECES,4
PARTY CHARMS 50 PIECES,4
PACK OF 6 SMALL FRUIT STRAWS,4
PACK OF 6 COCKTAIL PARASOL STRAWS,4
18PC WOODEN CUTLERY SET DISPOSABLE,0
6PC WOOD PLATE SET DISPOSABLE,0
T-LIGHT HOLDER SILVER HEART HANDLE,0
BLACK BAROQUE CARRIAGE CLOCK,1
PINK STOCKING CHRISTMAS DECORATION,4
RIDGED BONNE JAM JAR T-LIGHT HOLDER,0
CLASSICAL ROSE TABLE LAMP,1
SMALL APOTHECARY MEASURING JAR ,1
PINK CLEAR GLASS CANDLE PLATE,0
TREE T-LIGHT HOLDER WILLIE WINKIE,0
T-LIGHT HOLDER SILVER PETIT FOUR ,0
GLASS BONNE JAM JAR,3
WRAP VINTAGE LEAF DESIGN,4
PANTRY MAGNETIC  SHOPPING LIST,0
DRAWER KNOB VINTAGE GLASS HEXAGON,2
CORDIAL GLASS JUG,1
LARGE BONNE JAM JAR  T-LIGHT HOLDER,2
CHRISTMAS TREE HANGING SILVER ,4
CHRISTMAS TREE HANGING GOLD,4
SKETCHBOOK MAGNETIC SHOPPING LIST,0
RETRO LEAVES MAGNETIC NOTEPAD,0
DOORMAT CHRISTMAS VILLAGE,1
SET OF 4 SANTA PLACE SETTINGS,0
WHITE WICKER STAR ,2
IVORY REFECTORY CLOCK,1
RED REFECTORY CLOCK ,1
MINT DINER WALL CLOCK,1
PINK DINER WALL CLOCK,1
RETO LEAVES MAGNETIC SHOPPING LIST,0
CANDLE HOLDER SILVER MADELINE,0
VEGETABLE MAGNETIC  SHOPPING LIST,0
CHRISTMAS TABLE SILVER CANDLE SPIKE,4
DIAMANTE NECKLACE PURPLE,1
BLUE REFECTORY CLOCK ,1
APOTHECARY MEASURING JAR,1
LARGE APOTHECARY MEASURING JAR ,1
DOORKNOB CRACKED GLAZE PINK,0
DOORKNOB CRACKED GLAZE GREEN,0
DRAWER KNOB VINTAGE GLASS BALL,2
GLASS SONGBIRD STORAGE JAR,1
SET OF 2 TEA TOWELS PING MICROWAVE,2
SILVER BOOK MARK WITH BEADS,4
BELL HEART ANTIQUE GOLD,2
TRAVEL CARD WALLET VINTAGE LEAF,4
PINK EASTER HENS+FLOWER,3
LEAVES MAGNETIC  SHOPPING LIST,0
VIP PASSPORT COVER ,2
GARAGE KEY FOB,4
ROUND BLUE CLOCK WITH SUCKER,4
ROUND PURPLE CLOCK WITH SUCKER,4
FLOWER PURPLE CLOCK WITH SUCKER,4
FLOWER BLUE CLOCK WITH SUCKER,4
SET OF 4 KNICK KNACK TINS LEAF,3
GIANT 50'S CHRISTMAS CRACKER,2
MOROCCAN BEATEN METAL DISH,1
PACKING CHARGE,1
VINTAGE LEAF MAGNETIC NOTEPAD,0
BOX OF 6 MINI VINTAGE CRACKERS,2
BOX OF 6 MINI 50'S CRACKERS,2
COPPER AND BRASS BAG CHARM,1
IVORY GOLD METAL BAG CHARM,1
WHITE WITH METAL BAG CHARM,3
GREEN WITH METAL BAG CHARM,3
LARGE CRYSTAL DIAMANTE HAIRSLIDE,0
LARGE MINT DIAMANTE HAIRSLIDE,0
DOORMAT VINTAGE LEAF,1
RED PEONY TABLE CLOCK,2
KNITTED RABBIT DOLL ,0
LILAC FEATHERS CURTAIN,4
VINTAGE BEAD PINK JEWEL BOX,3
T-LIGHT HOLDER SILVER SAUCER,0
VINTAGE CHRISTMAS BUNTING,3
SET OF 6 TEA TIME BAKING CASES,0
SET OF 6 SNACK LOAF BAKING CASES,4
SET OF 12 FAIRY CAKE BAKING CASES,4
SET OF 12 MINI LOAF BAKING CASES,4
SET 40 HEART SHAPE PETIT FOUR CASES,0
PSYCHEDELIC METAL SIGN CALENDAR,4
ROUND ARTICULATED PINK CLOCK W/SUCK,4
"LETTER ""I"" BLING KEY RING",4
ENAMEL JUG PANTRY,3
ENAMEL BOWL PANTRY,0
ENAMEL MUG PANTRY,0
VINTAGE CHRISTMAS STOCKING ,2
VINTAGE CHRISTMAS TABLECLOTH,1
PACK OF SIX LED TEA LIGHTS,2
VINTAGE CHRISTMAS GIFT SACK,3
WRAP CHRISTMAS VILLAGE,4
BROWN KUKUI COCONUT SEED NECKLACE,4
BILI NUT AND WOOD NECKLACE,4
SPOTTED WHITE NATURAL SEED NECKLACE,4
WHITE FRANGIPANI NECKLACE,2
PURPLE FRANGIPANI NECKLACE,2
ROSE PENDANT TRIPLE SHELL NECKLACE,3
ORANGE PENDANT TRIPLE SHELL NECKLAC,3
WRAP ALPHABET POSTER  ,4
LAUREL STAR ANTIQUE GOLD,0
PURPLE/BLUE CERAMIC CANDLE HOLDER,0
BLUE/YELLOW CERAMIC CANDLE HOLDER,0
GREEN/BLUE CERAMIC CANDLE HOLDER,0
PURPLE DRESS JEWELLERY STAND,4
WRAP BIRD GARDEN ,4
WRAP PAISLEY PARK ,4
THE KING GIFT BAG 25x24x12cm,4
CUTE RABBIT CEATURE SCREEN ,4
CUTE BIRD CEATURE SCREEN,4
WRAP RED DOILEY,4
WRAP FLOWER SHOP  ,4
WRAP MAGIC FOREST ,4
BIRD ON BRANCH CANVAS SCREEN,0
WRAP 50'S  CHRISTMAS,4
BLUE MONTE CARLO HANDBAG,0
PINK/BLUE STRING CURTAIN ,0
I LOVE LONDON BEAKER,0
 DOLLY GIRL BEAKER,0
SPACEBOY BEAKER,0
DOORKNOB CERAMIC IVORY,0
ORIENTAL RED CUSHION COVER ,3
PINK BITTY LIGHT CHAIN,0
LIGHT PINK FLOCK GLASS CANDLEHOLDER,4
MONEY BOX FIRST AID DESIGN,0
VINTAGE CHRISTMAS CAKE FRILL,0
MISELTOE HEART WREATH CREAM,3
VINTAGE BEAD PINK JEWEL STAND,3
GOLD M.O.P ORBIT BRACELET,3
SET 8 CANDLES VINTAGE DOILEY,0
SET OF 12 T-LIGHTS VINTAGE DOILEY,0
