,categ_product
DOORMAT WELCOME SUNRISE,1
CAROUSEL DESIGN WASHBAG,0
TOXIC AREA  DOOR HANGER ,4
LA PALMIERA TILE COASTER,4
WAKE UP COCKEREL TILE COASTER,4
JIGSAW RABBIT AND BIRDHOUSE,0
PLASMATRONIC LAMP,1
4 BURGUNDY WINE DINNER CANDLES,0
SILVER OVAL SHAPE TRINKET BOX,1
WRAP BLUE RUSSIAN FOLKART,4
DAISY JOURNAL ,2
DUSTY PINK CHRISTMAS TREE 30CM,0
HANGING PHOTO CLIP ROPE LADDER,0
PINK PARTY SUNGLASSES,0
POSY CANDY BAG,0
BLACKCHRISTMAS TREE 30CM,0
SET OF PICTURE FRAME  STICKERS,2
MIRRORED WALL ART PHOTO FRAMES,3
SET/4 BADGES BALLOON GIRL,0
SMALL DOLLY MIX DESIGN ORANGE BOWL,4
POCKET MIRROR WOODLAND,0
SWEETIES  STICKERS,4
"TUMBLER, NEW ENGLAND",0
HEART SHAPE WIRELESS DOORBELL,2
MILK PAN RED RETROSPOT,3
ROUND CONTAINER SET OF 5 RETROSPOT,0
SET/6 PINK  BUTTERFLY T-LIGHTS,2
ASSORTED TUTTI FRUTTI SMALL PURSE,0
SET/6 GREEN SPRING PAPER CUPS,4
ASSORTED TUTTI FRUTTI LARGE PURSE,2
COFFEE SCENT PILLAR CANDLE,4
PINK ROSE WASHBAG,3
GARDENIA 1 WICK MORRIS BOXED CANDLE,3
SILVER LATTICE VANILLA CANDLE POT,3
4 WILDFLOWER BOTANICAL CANDLES,0
PACK 3 IRON ON DOG PATCHES,0
DAISY NOTEBOOK ,0
BLACK FINE BEAD NECKLACE W TASSEL,1
FIRE POLISHED GLASS NECKL BRONZE,1
ROUND PINK HEART MIRROR,2
GOLD COSMETIC BAG PINK STAR,2
EIGHT PIECE CREEPY CRAWLIE SET,0
SMOKEY GREY COLOUR D.O.F. GLASS,4
IVORY LOVE BIRD CANDLE,0
S/3 POT POURI CUSHIONS BLUE COLOURS,2
CHRISTMAS TREE PAINTED ZINC ,4
BLACK AND WHITE DOG BOWL,2
SPOTS ON RED BOOKCOVER TAPE,4
ASSORTED TUTTI FRUTTI HEART BOX,0
POLYESTER FILLER PAD 65CMx65CM,3
ASSORTED TUTTI FRUTTI NOTEBOOK,2
FRENCH BLUE METAL DOOR SIGN 6,0
SMALL RED RETROSPOT WINDMILL,0
HAND TOWEL PALE BLUE W FLOWERS,3
BLUE ORGANDY ROUND LAMPSHADE W BEA,4
WHITE AND BLUE CERAMIC OIL BURNER,0
PAPER CHAIN KIT SKULLS ,2
PINK FAIRY CAKE CUSHION COVER,3
GREEN POP ART MAO CUSHION COVER ,4
HEART SHAPED MIRROR,0
GOLD WASHBAG,2
PURPLE PAPER PARASOL,2
FRENCH GARDEN SIGN BLUE METAL,0
BROCANTE COAT RACK,1
WHITE GOOSE FEATHER CHRISTMAS TREE ,2
PINK PAISLEY ROSE GIFT WRAP,4
WOODLAND  STICKERS,4
SILVER TEDDY BEAR,3
PSYCHEDELIC WALL THERMOMETER,0
GARLAND WITH HEARTS AND BELLS,3
MAGIC DRAWING SLATE BUNNIES ,4
CERAMIC BIRDHOUSE CRESTED TIT SMALL,2
WRAP FOLK ART,4
SILVER JEWELLED MIRROR TRINKET TRAY,1
4 LILY  BOTANICAL DINNER CANDLES,2
ROSE DU SUD WASHBAG ,1
ROSE DU SUD COSMETICS BAG,3
GROW A FLYTRAP OR SUNFLOWER IN TIN,0
CAMOUFLAGE EAR MUFF HEADPHONES,1
BLUE POLKADOT EGG CUP ,4
VINTAGE BEAD PINK EVENING BAG,0
ENGLISH ROSE SCENTED HANGING FLOWER,0
PINK GLASS CANDLEHOLDER,2
CUPID DESIGN SCENTED CANDLES,2
SQUARE CHERRY BLOSSOM CABINET,1
BLUE ROSE PATCH PURSE PINK BUTTERFL,0
PACK OF 20 NAPKINS RED APPLES,4
ELEPHANT CARNIVAL POUFFE,1
WOODEN REGATTA BUNTING,1
FREESTYLE CANVAS ART PICTURE,0
CUBIC MUG FLOCK PINK ON BROWN,4
DAIRY MAID LARGE MILK JUG,3
CHILDS GARDEN SPADE PINK,2
CHILDS GARDEN BRUSH BLUE,2
MIRROR MOSAIC VOTIVE HOLDER,0
MINI JIGSAW BUNNIES,4
PORCELAIN BUDAH INCENSE HOLDER,4
ANTIQUE ALL GLASS CANDLESTICK,2
GREEN ROSE WASHBAG,3
WISE MAN STAR SHAPE EGG PAN,0
LOVE POTION MASALA INCENSE,4
SET OF 16 VINTAGE RED CUTLERY,1
PACK OF 20 SPACEBOY NAPKINS,4
WOOD STAMP SET FLOWERS,4
CALENDAR FAMILY FAVOURITES,2
BANQUET BIRTHDAY  CARD  ,4
FRENCH PAISLEY CUSHION COVER ,4
MULTICOLOUR SPRING FLOWER MUG,4
BATHROOM METAL SIGN ,0
SET/3 DECOUPAGE STACKING TINS,3
CUPBOARD 3 DRAWER MA CAMPAGNE,1
DECORATIVE ROSE BATHROOM BOTTLE,0
SILVER VANILLA  FLOWER CANDLE POT,3
PACK/12 XMAS FUN CARD,2
GREEN FERN SKETCHBOOK ,3
SET/6 BLACK BIRD T-LIGHT CANDLES,0
MIXED NUTS LIGHT GREEN BOWL,4
SET/6 IVORY BIRD T-LIGHT CANDLES,2
FRENCH ENAMEL WATER BASIN,3
BUTTONS AND STRIPES NOTEBOOK ,3
EAU DE NILE JEWELLED T-LIGHT HOLDER,4
TIGRIS EYE CHUNKY CHARM BRACELET,1
VINYL RECORD FRAME SILVER,3
SET OF 2 ROUND TINS CAMEMBERT ,2
SEWING SUSAN 21 NEEDLE SET,4
JET BLACK LAS VEGAS BRACELET ROUND,3
PURPLE LAS VEGAS BRACELET ROUND,3
WRAP DOLLY GIRL,4
BIRTHDAY BANQUET GIFT WRAP,4
CERAMIC PLATE STRAWBERRY DESIGN,0
CERAMIC CAKE DESIGN SPOTTED PLATE,0
BAKING MOULD HEART MILK CHOCOLATE,2
BAKING MOULD HEART WHITE CHOCOLATE,2
BAKING MOULD TOFFEE CUP CHOCOLATE,2
BAKING MOULD CHOCOLATE CUPCAKES,2
WRAP I LOVE LONDON ,4
BLUE SCANDINAVIAN PAISLEY WRAP,4
BAKING MOULD ROSE WHITE CHOCOLATE,3
BAKING MOULD ROSE MILK CHOCOLATE,3
T-LIGHT HOLDER SWEETHEART HANGING,0
PARTY FOOD SHOPPER BAG,0
 OVAL WALL MIRROR DIAMANTE ,1
FUSCHIA VOILE POINTY SHOE DEC,4
"LETTER ""C"" BLING KEY RING",4
"LETTER ""B"" BLING KEY RING",4
"LETTER ""K"" BLING KEY RING",0
BLACK MINI TAPE MEASURE ,4
S/4 BLACK MINI ROSE CANDLE IN BOWL,0
PIN CUSHION BABUSHKA RED,3
JAZZ HEARTS ADDRESS BOOK,4
MEDINA STAMPED METAL STOOL,1
PINK SMALL JEWELLED PHOTOFRAME,0
WHITE HANGING BEADS CANDLE HOLDER,1
BLUE NEW BAROQUE FLOCK CANDLESTICK,3
JUNGLE POPSICLES ICE LOLLY HOLDERS,0
PINK PAISLEY CUSHION COVER ,1
DAISY SKETCHBOOK ,3
TROPICAL  HONEYCOMB PAPER GARLAND ,2
RED RETROSPOT BIG BOWL,3
LARGE  TALL CAMPHOR WOOD TOADSTOOL ,1
LARGE CAMPHOR WOOD FIELD MUSHROOM ,3
MULTICOLOUR 3D BALLS GARLAND,2
QUEEN OF THE SKIES PASSPORT COVER ,2
POTTING SHED TWINE,2
EASTER DECORATION NATURAL CHICK,4
ASSORTED COLOUR SUCTION CUP HOOK,4
GINGHAM BABUSHKA DOORSTOP,2
DOORMAT MULTICOLOUR STRIPE,1
IVORY SCULPTED RND CANDLE ,4
COLUMBIAN CUBE CANDLE,0
HEART T-LIGHT HOLDER,0
FOLK ART METAL HEART T-LIGHT HOLDER,4
CHEST 7 DRAWER MA CAMPAGNE,1
CERAMIC BOWL WITH STRAWBERRY DESIGN,2
AMETHYST CHUNKY BEAD BRACELET W STR,1
AMBER CHUNKY BEAD BRACELET W STRAP,1
BLUE FLOCK CUSHION COVER ,2
VINTAGE NOTEBOOK BEAUTY GIRL,2
ZINC TOP  2 DOOR WOODEN SHELF ,1
PAIR BUTTERFLY HAIR CLIPS,3
DOORSTOP FOOTBALL DESIGN,3
A4 WALL TIDY BLUE OFFICE,4
CD WALL TIDY RED FLOWERS,4
MAGAZINE RACK GEBRA ASSORTED ,0
TEA TIME TEAPOT IN GIFT BOX,1
WALL MIRROR RECTANGLE DIAMANTE PINK,1
CHRISTMAS CRAFT HEART STOCKING ,2
HEART STRING MEMO HOLDER HANGING,0
BLUE PAISLEY SKETCHBOOK,3
ORANGE VOTIVE CANDLE,4
4 PINK FLOCK CHRISTMAS BALLS,0
METAL BASE FOR CANDLES,4
BOX OF 9 PEBBLE CANDLES,0
FLORAL BLUE MONSTER,3
SET/3 TALL GLASS CANDLE HOLDER PINK,1
BLUE POLKADOT KIDS BAG,2
GIFT BAG BIRTHDAY,4
FUNKY MONKEY GIFT BAG MEDIUM,4
CLEAR LOVE BIRD T-LIGHT HOLDER,3
PINK DIAMANTE PEN IN GIFT BOX,1
CHERRY BLOSSOM TABLE CLOCK ,3
REGENCY MIRROR WITH SHUTTERS,1
VINTAGE KITCHEN PRINT SEAFOOD,2
CARDHOLDER GINGHAM CHRISTMAS TREE,3
PINK CAT BOWL,0
SMALL MEDINA STAMPED METAL BOWL ,4
FAWN AND MUSHROOM GREETING CARD,4
BAKING MOULD CHOCOLATE CUP CAKES,2
SET/6 EAU DE NIL BIRD T-LIGHTS,0
CHILDS GARDEN RAKE BLUE,2
CHILDS GARDEN FORK PINK,4
CHILDS GARDEN TROWEL PINK,4
PINK REGENCY TEACUP AND SAUCER,2
FRENCH ENAMEL CANDLEHOLDER,2
GREEN SQUARE COMPACT MIRROR,0
BLUE HEART COMPACT MIRROR,2
JET BLACK LAS VEGAS NECKLACE 45CM,1
ASSORTED COLOUR METAL CAT ,0
TRIANGULAR POUFFE VINTAGE ,1
FELT TOADSTOOL LARGE,0
CHALKBOARD KITCHEN ORGANISER,1
4 LAVENDER BOTANICAL DINNER CANDLES,0
CAKE STAND 3 TIER MAGIC GARDEN,1
BAKING MOULD EASTER EGG MILK CHOC,2
DOORMAT MERRY CHRISTMAS RED ,1
CUT GLASS T-LIGHT HOLDER OCTAGON,2
FUNKY DIVA PEN,4
RIBBONS PURSE ,2
SET/4 SPRING FLOWER DECORATION,0
ASSORTED CIRCULAR MOBILE,4
ASS COL CIRCLE MOBILE ,4
METAL TUBE CHIME ON BAMBOO,0
"FLOWER GLASS GARLAND NECKL.36""BLACK",1
MEDIUM CHINESE STYLE SCISSOR,4
SMALL FOLDING SCISSOR(POINTED EDGE),4
BLUE BREAKFAST CUP AND SAUCER ,2
"RETRO ""TEA FOR ONE"" ",3
GARDEN PATH NOTEBOOK ,0
ABSTRACT CIRCLES POCKET BOOK,4
S/4 IVORY MINI ROSE CANDLE IN BOWL,0
SET/4 BLUE FLOWER CANDLES IN BOWL,0
RED RETROSPOT SMALL MILK JUG,2
HAIRCLIPS FORTIES FABRIC ASSORTED,4
RETROSPOT CANDLE  SMALL,0
3 TIER SWEETHEART GARDEN SHELF,1
FAIRY DREAMS INCENSE ,4
DRAGONS BLOOD INCENSE,4
GOLD FISHING GNOME,1
SILVER STANDING GNOME   ,3
DANISH ROSE PHOTO FRAME,0
HEARTS GIFT TAPE,4
SET OF 3 CONEY ISLAND OVAL BOXES,3
MINT GREEN ROSE TOWEL,3
SOFT PINK ROSE TOWEL ,3
HAND TOWEL PINK FLOWER AND DAISY,2
WHITE SOAP RACK WITH 2 BOTTLES,1
ROMANTIC IMAGES GIFT WRAP SET,4
CURIOUS IMAGES GIFT WRAP SET,4
VINTAGE BEAD PINK PURSE ,4
TEA TIME TEA SET IN GIFT BOX,1
POMPOM CURTAIN,1
SET OF 6 RIBBONS VINTAGE CHRISTMAS,2
ENGLISH ROSE SMALL SCENTED FLOWER,4
FRENCH BLUE METAL DOOR SIGN 4,0
SET OF 36 DOILIES SPACEBOY DESIGN ,0
HAWAIIAN GRASS SKIRT ,0
HEN HOUSE W CHICK STANDING,4
ASSORTED EASTER DECORATIONS  BELLS,0
BAKING MOULD EASTER EGG WHITE CHOC,2
SET/4 COLOURFUL MIXING BOWLS,1
SET OF 4 PISTACHIO LOVEBIRD COASTER,0
SET OF 4 BLACK LOVEBIRD COASTERS,0
TEA COSY BLUE STRIPE,2
EMPIRE DESIGN ROSETTE,0
DOORMAT WELCOME TO OUR HOME,1
GOLD STANDING GNOME,3
FIRST CLASS LUGGAGE TAG ,0
ASS COL LARGE SAND FROG P'WEIGHT,0
GREEN BIRDHOUSE DECORATION,4
HANGING CHICK CREAM DECORATION,0
BLUE POLKADOT GARDEN PARASOL,1
SILVER FABRIC MIRROR,4
WHITE HONEYCOMB PAPER GARLAND ,0
DANISH ROSE TRINKET TRAYS,3
SET 4 NURSERY DES ROUND BOXES,0
DANISH ROSE DELUXE COASTER,4
SMALL KITCHEN FLOWER POTS PLAQUE,1
KITCHEN FLOWER POTS WALL PLAQUE,1
BUNNY WOODEN PAINTED WITH FLOWER ,4
KITTY PENCIL ERASERS,4
BUNNY WOODEN PAINTED WITH BIRD ,4
WRAP GREEN RUSSIAN FOLKART ,4
LILY BROOCH OLIVE COLOUR,3
POPART RECT PENCIL SHARPENER ASST,4
LARGE TORTILLA DESIGN RED BOWL,2
YELLOW METAL CHICKEN HEART ,0
BLUE KNITTED HEN ,0
CANDY SPOT HEART DECORATION,4
PICNIC BOXES SET OF 3 RETROSPOT ,3
BOTTLE BAG RETROSPOT ,0
GREEN GOOSE FEATHER CHRISTMAS TREE ,3
HOLLY TOP CHRISTMAS STOCKING,4
FLOWER PURPLE CLOCK W/SUCKER,4
SKULLS DESIGN FLANNEL,4
ORIGAMI ROSE INCENSE/CANDLE SET ,0
ORIGAMI JASMINE INCENSE/CANDLE SET,0
ORIGAMI OPIUM INCENSE/CANDLE SET ,0
ORIGAMI SANDLEWOOD INCENSE/CAND SET,0
TALL ROCOCO CANDLE HOLDER,1
MINI CAKE STAND  HANGING STRAWBERY,0
FRUIT TREE AND BIRDS WALL PLAQUE,1
SPRIG LAVENDER ARTIFICIAL FLOWER,4
SET OF 3 PINK FLYING DUCKS,1
PAINTED PINK RABBIT ,4
FRYING PAN BLUE POLKADOT,3
PINK POLKADOT GARDEN PARASOL,1
ENCHANTED BIRD PLANT CAGE,3
PAPERWEIGHT VINTAGE COLLAGE,0
PAPERWEIGHT HOME SWEET HOME,0
STRAWBRY SCENTED VOTIVE CANDLE,4
LOVE SEAT ANTIQUE WHITE METAL,1
DOG BOWL VINTAGE CREAM,3
MIRROR MOSAIC GOBLET CANDLE HOLDER,3
MIRROR MOSAIC T-LIGHT HOLDER ,0
RATTLE SNAKE EGGS,0
MINI HIGHLIGHTER PENS,4
SILVER PHOTO FRAME,2
GOLD PHOTO FRAME,0
LIPSTICK PEN BABY PINK,4
KITTENS DESIGN FLANNEL,4
FRENCH BLUE METAL DOOR SIGN 2,0
SET OF 4 POLKADOT PLACEMATS ,3
CRYSTAL HOOP EARRING FLORAL LEAF,2
SILVER/AMETHYST DROP EARRINGS LEAF,2
CRYSTAL PAIR HEART HAIR SLIDES,3
MIDNIGHT BLUE PAIR HEART HAIR SLIDE,3
PINK VINTAGE VICTORIAN EARRINGS,2
ROSE COLOUR PAIR HEART HAIR SLIDES,3
RETROSPOT CANDLE  MEDIUM,0
SMALL TALL CAMPHOR WOOD TOADSTOOL,0
BLOSSOM IMAGES GIFT WRAP SET,4
ASSORTED EASTER GIFT TAGS,4
ENVELOPE 50 BLOSSOM IMAGES,4
EASTER TIN KEEPSAKE,0
EASTER TIN CHICKS IN GARDEN,0
JIGSAW TREE WITH WATERING CAN,4
JIGSAW TOADSTOOLS 3 PIECE,4
EASTER TIN BUCKET,2
BLUE TILED TRAY,1
ASSORTED LAQUERED INCENSE HOLDERS,4
CARTOON  PENCIL SHARPENERS,4
TROPICAL HOLIDAY PURSE ,2
CAROUSEL PONIES BABY BIB,4
VIP HOLIDAY PURSE,3
CAKES AND RABBITS DESIGN FLANNEL ,4
PARTY TIME DESIGN FLANNEL,4
ECONOMY HOLIDAY PURSE,2
OLD DOC RUSSEL METAL SIGN,2
NINJA RABBIT PINK,0
BLUE SHARK HELICOPTER,1
GREEN WIRE STANDING CANDLE HOLDER,3
ROMANTIC IMAGES SCRAP BOOK SET,3
MINI JIGSAW PURDEY,4
LETTER SHAPE PENCIL SHARPENER,4
BLACK STITCHED WALL CLOCK,0
DOOR HANGER  MUM + DADS ROOM,0
QUEEN OF THE SKIES HOLIDAY PURSE ,3
GOLD SCROLL GLASS T-LIGHT HOLDER,0
GLASS JAR MARMALADE ,2
PINK BUTTERFLY WASHBAG,3
S/4 PINK FLOWER CANDLES IN BOWL,0
"FLOWER GLASS GARLD NECKL36""AMETHYST",1
PURPLE BOUDICCA LARGE BRACELET,1
RED BOUDICCA LARGE BRACELET,1
ANT COPPER TURQ BOUDICCA BRACELET,3
TURQ+RED BOUDICCA LARGE BRACELET,1
PINK BOUDICCA LARGE BRACELET,1
"BATHROOM SCALES, TROPICAL BEACH",3
LARGE PINK GLASS SUNDAE DISH,4
CHARLIE & LOLA WASTEPAPER BIN BLUE,0
BLACK CHRISTMAS FLOCK DROPLET ,0
WHITE CHRISTMAS FLOCK DROPLET ,0
FLOWERS TILE HOOK,0
DANISH ROSE BEDSIDE CABINET,1
CAKE STAND VICTORIAN FILIGREE LARGE,1
PINK GLASS TASSLE BAG CHARM ,2
WHITE MURANO TWIST BRACELET,3
DOORSTOP RACING CAR DESIGN,2
BLACK SILOUETTE CANDLE PLATE,4
4 VANILLA BOTANICAL CANDLES,0
HEN PARTY CORDON BARRIER TAPE,0
VINTAGE UNION JACK SHOPPING BAG,3
FRENCH KITCHEN SIGN BLUE METAL,0
EMPIRE GIFT WRAP,4
CANDLE PLATE LACE WHITE,2
ANT SILVER FUSCHIA BOUDICCA RING,2
PINK/WHITE GLASS DEMI CHOKER,1
GOLD M PEARL  ORBIT NECKLACE,1
CHUNKY SILVER NECKLACE PASTEL FLOWE,1
IVORY SHELL HEART NECKLACE,1
MOROCCAN BEATEN METAL DISH LARGE,1
ZINC HEART LATTICE T-LIGHT HOLDER,0
RIDGED GLASS T-LIGHT HOLDER,4
ZINC HEART LATTICE CHARGER LARGE,3
ZINC HEART LATTICE CHARGER SMALL,2
SILVER APERITIF GLASS,4
ANTIQUE GLASS PLACE SETTING,0
SET OF 6 HERB TINS SKETCHBOOK,3
SET OF 6 SPICE TINS PANTRY DESIGN,3
SET OF 3 CAKE TINS PANTRY DESIGN ,3
PINK DOG CANNISTER,3
ORANGE TV TRAY TABLE ,2
BLUE TV TRAY TABLE ,3
PURPLE BERTIE GLASS BEAD BAG CHARM,0
SWEETHEART CREAM STEEL TABLE RECT,1
GREY ACRYLIC FACETED BANGLE,0
MR ROBOT SOFT TOY,3
LARGE CAKE TOWEL CHOCOLATE SPOTS,3
DANISH ROSE FOLDING CHAIR,1
PINK LOVE BIRD CANDLE,0
DIAMANTE RING ASSORTED IN BOX.,0
RED   ACRYLIC FACETED BANGLE,0
PURPLE ACRYLIC FACETED BANGLE,0
VINTAGE BLUE KITCHEN CABINET,1
SMALL PINK GLASS SUNDAE DISH,4
HOME GARLAND PAINTED ZINC ,4
SET 3 WICKER STORAGE BASKETS ,1
SILVER ROCOCO CANDLE STICK,3
RED VICTORIAN FABRIC OVAL BOX,4
NUMBER TILE VINTAGE FONT 8,0
NUMBER TILE VINTAGE FONT 5,0
DANISH ROSE DECORATIVE PLATE,0
WAKE UP COCKEREL TILE HOOK,0
BAKING MOULD TOFFEE CUP  CHOCOLATE,2
BAKING MOULD CUPCAKE CHOCOLATE,2
SET OF 3 CAKE TINS SKETCHBOOK,3
VIPPASSPORT COVER ,0
VINTAGE BEAD PINK SCARF ,0
WHITE HAND TOWEL WITH BUTTERFLY,3
WRAP CIRCUS PARADE,4
CHILDS GARDEN FORK BLUE ,4
CHILDS GARDEN TROWEL BLUE ,4
HAPPY EASTER HANGING DECORATION,3
HANGING HEART BASKET,2
3D HEARTS  HONEYCOMB PAPER GARLAND,2
HANGING SPRING FLOWER EGG LARGE,4
WHITE STITCHED WALL CLOCK,0
SET OF 4 CAROUSEL PLACEMATS ,2
ASSTD COL BUTTERFLY/CRYSTAL W/CHIME,4
BLUE DAISY MOBILE,4
ASS FLORAL PRINT MULTI SCREWDRIVER,4
NUMBER TILE VINTAGE FONT No ,0
NUMBER TILE VINTAGE FONT 9 ,0
NUMBER TILE VINTAGE FONT 7,0
NUMBER TILE VINTAGE FONT 6 ,0
NUMBER TILE VINTAGE FONT 4,0
NUMBER TILE VINTAGE FONT 3,0
NUMBER TILE VINTAGE FONT 2,0
NUMBER TILE VINTAGE FONT 1,0
NUMBER TILE VINTAGE FONT 0,0
CERAMIC LOVE HEART MONEY BANK,4
PENS ASSORTED SPACEBALL,4
PENS ASSORTED FUNKY JEWELED ,4
VINTAGE PINK DECORATIVE PARASOL,3
HIPPY CHIC DECORATIVE PARASOL,1
MRS ROBOT SOFT TOY,3
PINK BERTIE GLASS BEAD BAG CHARM,0
PINK HEARTS LIGHT CHAIN ,3
RED HEARTS LIGHT CHAIN ,3
SET/6 FROG PRINCE T-LIGHT CANDLES,2
"WHITE TEA,COFFEE,SUGAR JARS",2
PINK STITCHED WALL CLOCK,0
JAM JAR WITH BLUE LID,4
GLASS CHALICE GREEN  SMALL ,0
BLUE POT PLANT CANDLE ,3
FROSTED WHITE BASE ,4
MULTICOLOUR HONEYCOMB PAPER GARLAND,0
MILK PAN BLUE POLKADOT,3
CRYSTAL STUD EARRINGS ASSORTED COL ,4
RETRO BROWN BALL ASHTRAY ,0
BEACH HUT DESIGN BLACKBOARD,3
FIRST CLASS PASSPORT COVER ,2
TURQ ICE CREAM BUM BAG ,2
SILVER ROCCOCO CHANDELIER,1
PINK FLY SWAT,4
BLUE FLY SWAT,4
LARGE RED RETROSPOT WINDMILL,2
ORIGAMI ROSE INCENSE IN TUBE,4
METAL SIGN CUPCAKE SINGLE HOOK,4
IVORY HANGING DECORATION  EGG,4
VINTAGE RED MUG,0
CAKE PLATE LOVEBIRD PINK,3
AMBER DIAMANTE EXPANDABLE RING,3
FINE SILVER NECKLACE W PASTEL FLOWE,1
ANT COPPER PINK BOUDICCA BRACELET,3
ANT COPPER LIME BOUDICCA BRACELET,3
GREEN GLASS TASSLE BAG CHARM,2
TURQUOISE GLASS TASSLE BAG CHARM ,2
EGG CUP NATURAL CHICKEN,4
SET/4 RED MINI ROSE CANDLE IN BOWL,0
FELT FARM ANIMAL SHEEP,0
FELT FARM ANIMAL RABBIT,0
FELT FARM ANIMAL HEN,0
PINK CHRISTMAS FLOCK DROPLET ,0
"ACRYLIC JEWEL SNOWFLAKE,PINK",2
JARDIN ETCHED GLASS FRUITBOWL,1
RIDGED GLASS POSY VASE ,0
BLACK CHRISTMAS TREE 120CM,3
FRESHWATER PEARL BRACELET GOLD,2
PALE PINK/AMETHYST STONE NECKLACE,1
FIRE POLISHED GLASS NECKL GOLD,1
"PEARL & SHELL 42""NECKL. GREEN",1
TEAL/FUSCHIA COL BEAD NECKLACE,3
AMBER FINE BEAD NECKLACE W TASSEL,1
PINK FLOCK GLASS CANDLEHOLDER,4
JARDIN ETCHED GLASS SMALL BELL JAR,3
BOTANICAL ROSE GREETING CARD,4
BOTANICAL LILY GREETING CARD,4
BLACK MEDIUM GLASS CAKE STAND,0
STRIPES DESIGN MONKEY DOLL,2
S/4 GROOVY CAT MAGNETS,0
BLUE GINGHAM ROSE CUSHION COVER,1
PING! MICROWAVE PLATE,2
MINI PAINTED GARDEN DECORATION ,4
ASSTD FRUIT+FLOWERS FRIDGE MAGNETS,4
ORIGAMI LAVENDER INCENSE/CANDL SET ,0
PINK  HONEYCOMB PAPER FAN,4
CLASSIC FRENCH STYLE BASKET GREEN ,3
FOLDING UMBRELLA BLACKBLUE POLKADOT,1
ORIGAMI VANILLA INCENSE CONES,4
ORIGAMI VANILLA INCENSE/CANDLE SET ,0
NUMBER TILE COTTAGE GARDEN 0 ,0
NUMBER TILE COTTAGE GARDEN 9,0
NUMBER TILE COTTAGE GARDEN No,2
NUMBER TILE COTTAGE GARDEN 6,0
NUMBER TILE COTTAGE GARDEN 2,0
NUMBER TILE COTTAGE GARDEN 7,0
NUMBER TILE COTTAGE GARDEN 5,0
NUMBER TILE COTTAGE GARDEN 4,0
NUMBER TILE COTTAGE GARDEN 1,0
NUMBER TILE COTTAGE GARDEN 3 ,0
COFFEE MUG PEARS  DESIGN,2
SCOTTIES DESIGN WASHBAG,0
ROUND WHITE CONFETTI IN TUBE,0
PINK  HEART CONFETTI IN TUBE,0
CAKE STAND LACE WHITE,3
LONDON BUS COFFEE MUG,2
PINK ENAMEL+GLASS HAIR COMB,2
COFFEE MUG APPLES DESIGN,2
CERAMIC BOWL WITH LOVE HEART DESIGN,0
BOTANICAL ROSE GIFT WRAP,4
PINK SPOTS CHOCOLATE NESTING BOXES ,2
QUEENS GUARD COFFEE MUG,2
GREEN ROUND COMPACT MIRROR,0
SET/4 WHITE RETRO STORAGE CUBES ,1
PSYCHEDELIC TILE COASTER,4
RED PUDDING SPOON,4
MULTICOLOUR RABBIT EGG WARMER,0
CURIOUS IMAGES SCRAP BOOK SET,3
MAGIC SHEEP WOOL GROWING FROM PAPER,0
SET OF 4 DIAMOND NAPKIN RINGS,1
PINK NEW BAROQUE FLOCK CANDLESTICK,3
SILVER HOOP EARRINGS WITH FLOWER,1
SILVER LARIAT BLACK STONE EARRINGS,3
APRON MODERN VINTAGE COTTON,2
PAPERWEIGHT VINTAGE PAISLEY,0
POLKADOT COFFEE CUP & SAUCER PINK,4
EAU DE NIL LOVE BIRD CANDLE,0
BLACK SMALL GLASS CAKE STAND,0
SKULLS STORAGE BOX LARGE,2
PAPERWEIGHT KINGS CHOICE ,0
FELT EGG COSY LADYBIRD ,4
HOUSE SHAPE PENCIL SHARPENER,4
VINTAGE KITCHEN PRINT FRUITS,2
TEATIME ROUND PENCIL SHARPENER ,4
MOBILE VINTAGE HEARTS ,3
FRENCH LAVENDER SCENT HEART,4
4 PINK DINNER CANDLE SILVER FLOCK,2
ORIGAMI SANDLEWOOD INCENSE+FLOWER,0
ENAMEL PINK TEA CONTAINER,0
ENAMEL PINK COFFEE CONTAINER,0
TROPICAL PASSPORT COVER ,2
SUNFLOWER DECORATIVE PARASOL,1
PINK FLUFFY CHRISTMAS DECORATION,4
MONEY BOX HOUSEKEEPING DESIGN,0
IVORY HANGING DECORATION  BIRD,4
SILVER DISCO HANDBAG,2
SILVER T-LIGHT SETTING,1
BLOSSOM IMAGES SCRAP BOOK SET,3
RETROSPOT CANDLE  LARGE,0
DECORATION WHITE CHICK MAGIC GARDEN,4
MONEY BOX FIRST ADE DESIGN,0
PINK GINGHAM CAT WITH SCARF,2
FLORAL SOFT CAR TOY,3
PINK CHICK EGG WARMER + EGG CUP,0
BLUE  TILE HOOK,2
PINK FELT EASTER RABBIT GARLAND,2
SCHOOL DESK AND CHAIR ,1
WHITE BAROQUE WALL CLOCK ,1
BLACK BAROQUE WALL CLOCK ,1
SET/3 POLKADOT STACKING TINS,3
TEA COSY RED  STRIPE,2
WOODLAND STORAGE BOX LARGE ,2
CAKE STAND LOVEBIRD 2 TIER PINK,1
POLYESTER FILLER PAD 30CMx30CM,0
MOCK LOBSTER FRIDGE MAGNET,4
WOODEN BOX ADVENT CALENDAR ,1
DROP DIAMANTE EARRINGS PURPLE,2
ANT COPPER RED BOUDICCA BRACELET,3
DROP DIAMANTE EARRINGS BLACK DIAMON,2
VINTAGE ROSE BEAD BRACELET RASPBERR,3
LAZER CUT NECKLACE W PASTEL BEADS,1
5 STRAND GLASS NECKLACE AMBER,1
SILVER/MOP ORBIT NECKLACE,1
DAISY HAIR BAND,0
PURPLE CHUNKY GLASS+BEAD NECKLACE,1
SUMMER DAISIES BAG CHARM,2
CLASSIC FRENCH STYLE BASKET BROWN,3
EAU DE NILE JEWELLED PHOTOFRAME,2
PINK BOUDOIR T-LIGHT HOLDER,4
CREAM DELPHINIUM ARTIFICIAL FLOWER,2
LARGE WHITE/PINK ROSE ART FLOWER,0
MEDIUM WHITE/PINK ROSE ART FLOWER,0
WHITE ANEMONE ARTIFICIAL FLOWER,0
PINK CANDYSTUFT ARTIFICIAL FLOWER,0
PINK BABY BUNTING,2
"DECORATION , WOBBLY RABBIT , METAL ",0
FROG CANDLE,0
WRAP MONSTER FUN ,4
TOYBOX  WRAP ,4
BLUE BLOSSOM HAIR CLIP,0
PINK STRAWBERRY HANDBAG ,2
MIRRORED WALL ART TABLE LAMP,0
SMALL SKULL WINDMILL,0
SET/3 RABBITS FLOWER SKIPPPING ROPE,4
BEADED CRYSTAL HEART GREEN LARGE,4
"GREETING CARD,SQUARE, DOUGHNUTS",4
DINOSAUR HEIGHT CHART STICKER SET,2
HOT WATER BOTTLE BABUSHKA LARGE,3
BIRTHDAY BANNER TAPE,0
MINI JIGSAW GO TO THE FAIR,4
WHITE HEART CONFETTI IN TUBE,0
GLASS BEAD HOOP EARRINGS BLACK,2
GLASS BEAD HOOP EARRINGS AMETHYST,2
SILVER M.O.P ORBIT BRACELET,3
MURANO STYLE GLASS BRACELET RED,3
GREEN MURANO TWIST BRACELET,3
MURANO STYLE GLASS BRACELET BLACK,3
CANNABIS LEAF BEAD CURTAIN,4
OPIUM SCENTED VOTIVE CANDLE,4
"LETTER ""D"" BLING KEY RING",4
LOVE HEART TRINKET POT,4
PINK POT PLANT CANDLE,3
GLOW IN DARK DOLPHINS,4
LAVENDER SCENT CAKE CANDLE,4
FRENCH BLUE METAL DOOR SIGN 7,0
YELLOW DRAGONFLY HELICOPTER,1
CHEST NATURAL WOOD 20 DRAWERS,1
WHEELBARROW FOR CHILDREN ,1
CHILDS GARDEN RAKE PINK,2
BAKING SET 9 PIECE RETROSPOT ,3
PINK PAPER PARASOL ,3
12 EGG HOUSE PAINTED WOOD,1
PINK METAL CHICKEN HEART ,0
GREEN CAT FLORAL CUSHION COVER ,3
EDWARDIAN DROP EARRINGS JET BLACK,3
PURPLE FRANGIPANI HAIRCLIP,4
BLACK FLOWER CANDLE PLATE,4
BLUE EGG  SPOON,4
VINTAGE RED TEATIME MUG,0
POPART WOODEN PENCILS ASST,4
RED POLKADOT BEAKER ,4
SET OF 36 DINOSAUR PAPER DOILIES,0
TEA PARTY  WRAPPING PAPER ,4
WHITE ROSEBUD  PEARL EARRINGS,2
RED PURSE WITH PINK HEART,0
BLUE CHENILLE SHAGGY CUSHION COVER ,0
PINK CAT FLORAL CUSHION COVER ,3
VINTAGE GLASS TEA CADDY,1
RELAX LARGE WOOD LETTERS,1
FLOWERS TILE COASTER,4
JARDIN ETCHED GLASS CHEESE DISH,3
HANGING CHICK GREEN DECORATION,0
HANGING HEN ON NEST DECORATION,0
EASTER CRAFT 4 CHICKS ,0
SILVER FISHING GNOME ,1
BOX/12 CHICK & EGG IN BASKET,0
HANGING SPRING FLOWER EGG SMALL,4
MINI LADLE LOVE HEART RED ,4
CARD WEDDING DAY,4
PINK/FLOWER RABBIT EGG WARMER ,2
75 GREEN FAIRY CAKE CASES,4
SET OF 16 VINTAGE BLACK CUTLERY,1
ENGLISH ROSE METAL WASTE BIN,2
WRAP DAISY CARPET ,4
SET/3 POT PLANT CANDLES,1
WRAP WEDDING DAY,4
HANGING METAL RABBIT DECORATION,0
FUSCHIA RETRO BAR STOOL,1
CONDIMENT TRAY 4 BOWLS AND 4 SPOONS,1
CANDY SPOT BUNNY,2
PINK SCOTTIE DOG W FLOWER PATTERN,2
BLUE SCOTTIE DOG W FLOWER PATTERN,2
RABBIT EASTER DECORATION,2
MULTICOLOUR EASTER RABBIT ,0
HILDA CANDY SPOT RABBIT,3
ANTIQUE CREAM CUTLERY SHELF ,1
VINTAGE WOODEN BAR STOOL,1
YELLOW POT PLANT CANDLE,3
DAISY FOLKART HEART DECORATION,0
PAINTED YELLOW WOODEN DAISY,4
DAISIES  HONEYCOMB GARLAND ,0
CONGRATULATIONS BUNTING,1
PSYCHEDELIC TILE HOOK,4
VINTAGE KITCHEN PRINT PUDDINGS,2
ICON PLACEMAT POP ART ELVIS,4
CAKE STAND VICTORIAN FILIGREE SMALL,3
"WRAP, CAROUSEL",4
GLASS CHALICE BLUE SMALL ,4
EAU DE NILE HEART SHAPE PHOTO FRAME,0
BLUE  VOILE LAMPSHADE,2
ROSE DU SUD DRAWSTRING BAG,3
SET/6 COLLAGE PAPER CUPS,4
SET/6 FRUIT SALAD PAPER CUPS,4
SET/6 FRUIT SALAD  PAPER PLATES,4
CANDY SPOT EGG WARMER HARE,4
CANDY SPOT EGG WARMER RABBIT,4
"GREETING CARD, STICKY GORDON",4
"GREETING CARD, OVERCROWDED POOL.",4
DECORATION  BUTTERFLY  MAGIC GARDEN,4
DECORATION  PINK CHICK MAGIC GARDEN,4
BUNNY DECORATION MAGIC GARDEN,4
"GREETING CARD, TWO SISTERS.",4
SET OF 4 POLKADOT COASTERS,0
CITRUS GARLAND FELT FLOWERS ,0
SET/4 BADGES DOGS,0
SET/4 BADGES BEETLES,0
EASTER DECORATION HANGING BUNNY,4
EASTER DECORATION SITTING BUNNY,4
EASTER DECORATION EGG BUNNY ,4
ROSE DU SUD CUSHION COVER,1
LIGHTHOUSE PRINTED METAL SIGN,3
TURQUOISE HEART OF GLASS BRACELET,1
GREEN HEART OF GLASS BRACELET,1
PINK CRYSTAL+GLASS BRACELET,3
BLACK CHUNKY BEAD BRACELET W STRAP,1
TURQUOISE CRYSTAL+GLASS BRACELET,3
RESIN BRACELET W PASTEL BEADS,3
RESIN NECKLACE W PASTEL BEADS,1
LARGE CIRCULAR MIRROR MOBILE,0
NEW BAROQUE JEWELLERY BOX ,1
NEW BAROQUE BLACK BOXES,1
MOROCCAN BEATEN METAL MIRROR,1
BLUE CRUSOE CHECK LAMPSHADE,4
VINTAGE KITCHEN PRINT VEGETABLES,2
HANGING WOOD AND FELT BUTTERFLY ,4
HANGING WOOD AND FELT FLOWER,4
SET OF 12 MINI BUNNIES IN A BUCKET,2
NINJA RABBIT BLACK,0
DECORATIVE FLORE BATHROOM BOTTLE,0
BLOSSOM  IMAGES NOTEBOOK SET,0
PINK HEART RED HANDBAG,2
LITTLE PINK MONSTER SOFT TOY,2
TEA TIME TEA TOWELS ,2
PASTEL COLOUR HONEYCOMB FAN,4
PINK CHERRY LIGHTS,1
HANGING RIDGE GLASS T-LIGHT HOLDER,0
COLOURFUL FLOWER FRUIT BOWL,2
EASTER TREE YELLOW BIRDS,1
FIRST CLASS HOLIDAY PURSE ,3
GLASS CAKE COVER AND PLATE,1
BIRD DECORATION GREEN POLKADOT,4
PINK POLKADOT KIDS BAG,0
MIRROR MOSAIC T-LIGHT HOLDER ROUND,0
WRAP DOILEY DESIGN,4
PINK RETRO BIG FLOWER BAG,0
MINI LADLE LOVE HEART PINK,4
WHITE/PINK CHICK DECORATION,0
WRAP ALPHABET DESIGN,4
PINK FELT EASTER EGG BASKET,0
FOLK FELT HANGING MULTICOL GARLAND,3
HANGING BUTTERFLY  EGG,4
PINK HANGING GINGHAM EASTER HEN,4
BLUE HANGING GINGHAM EASTER HEN,4
"DECORATION , WOBBLY CHICKEN, METAL ",0
BUNNY EGG GARLAND,4
BLOND DOLL DOORSTOP,0
BLACK/WHITE GLASS/SILVER BRACELET,1
YELLOW EASTER EGG HUNT START POST,0
GREEN EASTER EGG HUNT START POST,0
EASTER BUNNY GARLAND OF FLOWERS,4
CANDY SPOT CUSHION COVER,2
AQUA BERTIE GLASS BEAD BAG CHARM,0
SET 3 SONG BIRD PAPER EGGS ASSORTED,2
SET 3 PAPER VINTAGE CHICK PAPER EGG,2
PEG BAG APPLE DESIGN,2
FRYING PAN RED POLKADOT ,3
SET/5 RED SPOTTY LID GLASS BOWLS,2
LUNCH BAG RED SPOTTY,0
MIRRORED WALL ART LADIES,4
BEADED CRYSTAL HEART PINK ON STICK,0
BEADED CRYSTAL HEART BLUE ON STICK,0
BEADED CRYSTAL HEART GREEN ON STICK,4
ASSTD RASTA KEY-CHAINS,4
WRAP POPPIES  DESIGN,4
EASTER BUNNY HANGING GARLAND,0
BUNNY EGG BOX,0
EASTER BUNNY WITH BASKET ON BACK,4
BLUE EASTER EGG HUNT START POST,0
3 PINK HEN+CHICKS IN BASKET,0
12 PINK HEN+CHICKS IN BASKET,2
EASTER BUNNY WREATH,3
FROG KING WATERING CAN,2
PIN CUSHION BABUSHKA BLUE,3
50CM METAL STRING WITH  7 CLIPS,4
ASSORTED SHAPES PHOTO CLIP SILVER ,4
WRAP VINTAGE PETALS  DESIGN,4
PINK BUTTERFLY CUSHION COVER ,3
WHITE CANDYSTUFT ARTIFICIAL FLOWER,0
2 PICTURE BOOK EGGS EASTER BUNNY,0
PINK METAL SWINGING BUNNY,4
ASSORTED FARMYARD ANIMALS IN BUCKET,4
RED PAPER PARASOL,2
MINI  ZINC GARDEN DECORATIONS ,4
MEDIUM CERAMIC TOP STORAGE JAR,0
ZINC HEART LATTICE 2 WALL PLANTER,1
FLAG OF ST GEORGE ,0
BLUE VICTORIAN FABRIC OVAL BOX,4
BLUE SAVANNAH PICNIC HAMPER FOR 2,1
HEN HOUSE W FAMILY IN BARN & NEST,4
RED/CREAM STRIPE CUSHION COVER ,0
PINK CHERRY BLOSSOM CUP & SAUCER,0
"DIAMANTE HEART SHAPED WALL MIRROR, ",1
"LETTER ""R"" BLING KEY RING",4
FOUR RABBIT EASTER DECORATIONS,0
SET OF 4 GREEN CAROUSEL COASTERS,0
SMALL ROUND CUT GLASS CANDLESTICK,3
PINK HYDRANGEA ART FLOWER,2
CROCHET ROSE PURSE WITH SUEDE BACK,2
LA PALMIERA TILE HOOK,4
SMALL WHITE/PINK ROSE ART FLOWER,0
OYSTER TRINKET BOX,2
BEADED CRYSTAL HEART BLUE  LARGE,4
GREEN FERN POCKET BOOK,4
MIRRORED WALL ART POPPIES,0
SET/6 POSIES PAPER PLATES,4
FIVE CATS HANGING DECORATION,3
RED DAISY PAPER LAMPSHADE,0
PIG MUG IN TWO COLOUR DESIGNS,4
FLAMES SUNGLASSES PINK LENSES,0
PINK PILLAR CANDLE SILVER FLOCK,2
STANDING FAIRY POLE SUPPORT ,4
2 PICTURE BOOK EGGS EASTER DUCKS,0
RUBY DROP CHANDELIER EARRINGS,3
VINTAGE ENAMEL & CRYSTAL EARRINGS,3
COLUMBIAN  CUBE CANDLE ,4
2 PICTURE BOOK EGGS EASTER CHICKS,0
